SName,LyricSerá (por Amor),"Será que voce ja me esqueceu?
Será que o culpado fui eu?

Será que nao tem mais jeito?
Que eu vou ter que ti arrancar do meu peito?

Por amor
A gente deixa o coração se arriscar
E fica a beira de um abismo...
Sozinha...
Sem saber como voltar

Ja fiz de tudo para não magoar você
Eu esqueci da minha vida
Dos meus sonhos
Só queria te enxergar

Mas sera que tanto amor não pode evitar
Que você fosse embora

Deixando a solidão...
Entrar por essa porta...
Pra me fazer chorar...

Será que voce ja me esqueceu?
Será que a culpada fui eu?

Será que nao tem mais jeito?
Que eu vou ter que ti arrancar do meu peito..."
Será Que Vai Rolar,"Será que vai rolar?
Eu e você será que vai rolar?
O meu desejo é ficar com você
O seu desejo é o que eu quero saber

Tô gostando de você
de um jeito diferente não da prá esconder
mudou completamente a minha opinião
tem coisas que so quem decide é coração

Só não sei se você sabe
Se também ja percebeu
Pra não perder sua amizade
Finjo que nada aconteceu

Penso em você todo instante
faz tempo que eu não me sentia assim
só tem graça viver com você aqui perto de mim
Será que vai rolaR?

Eu e você será que vai rolaR?
O meu desejo é ficar com você
O seu desejo é o que eu quero saber

Será que vai rolar?
Eu e você será que vai rolar?
Apaixonado está meu coração
Quero saber se vai ser sim ou não."
Sete Milhões,"B g#m c#m
Vou deixar voce falar pra ver se vai conseguir me

F# f#
Explicar, motivos pelos quais vai me deixar

B f# g#m
Eu te dei de tudo, nao te faltou nada,

C#m f# b
Amor carinho e atenção, tudo o que precisava

B
g#m
Foram sete anos de amor, foram sete anos de prazer

C#m f# b
E nem em sete milhões poderei te esquecer f#7

B g#m

Agora voce diz que vai embora, só queria saber por que,

C#m f# b

Como é que tao de pressa conseguiu me esquecer f#7

B f# g#m

Agora conte tudo, nao me esconda nada, se eu errei

F# b
Peço perdão, mais nao saia dessa casa;

B g#m
Foram sete anos de amor, foram sete anos de prazer

C#m f# b
E nem em sete milhões poderei te equecer f#7

C# bbm g#
Se existe outra pessoa, não exite em me dizer,

C# bm g#
Mais acredite não há no mundo um amor tão grande e

D#m f# g#
Profundo como o que eu dei a voce c#

C# bm
Mais acredite, não há no mundo um amor tão grande e

D#m f# g#
Profundo, como o que eu dei a voce c#

B
g#m
Foram sete anos de amor, foram sete anos de prazer

C#m f# b
E nem em sete milhões poderei te esquecer f#7"
Seu Amor É Bom,"Não sabe mesmo
nunca sabe o que quer
não se decide não quer me fazer mulher
você já não se importa quando eu digo
se quero o seu amor

Não sabe mesmo
nunca sabe o que quer
não se decide não quer me fazer mulher
você já não se importa quando eu digo
se quero o seu amor
é tudo que eu quero ter o seu amor

Seu amor é bom bom é lindo demais mais
seu amor me traz a paz 2x

Não sabe mesmo
nunca sabe o que quer
não se decide não quer me fazer mulher
você já não se importa quando eu digo
se quero o seu amor
é tudo que eu quero ter o seu amor

Seu amor é bom bom é lindo demais mais
seu amor me traz a paz 2x

Se quiser partir eu não vou deixar
eu não vou me acostumar
com um outro amor pensando em ti
E se me dizer que não me quer mais
está amando outro rapaz
pelo amor de deus não quero ouvir
Eu vou me matar me jogar ao mar preciso
saber o que foi que eu fiz amor
foi você quem quis assim
não quis cuidar de mim me teve mais
não soube dar valor
hoje eu quero um outro alguém
que me ame tambem que
me carinho e de me amor,
muito amor"
Seu Namorado,"Eu não vou te deixar
Eu quero é mais te amar
E ter você pra sempre do meu lado.

Não da mais pra ficar longe de você assim amor,amor
A distancia entre nós dois está muito ruim
Por favor liga pra mim

Eu não vou te deixar
Eu quero é mais te amar
Ter você pra sempre do meu lado
Tudo o que eu sempre quis foi te fazer feliz
E ser pra sempre o seu namorado
Volta fica pra sempre do meu lado
Que ainda sou aquele homem apaixonado
Que te perdeu
E hoje reconheceu que o erro foi só meu

Não da mais pra ficar longe de você assim amor,amor
A distancia entre nós dois esta muito ruim
Por favor liga pra mim
Eu não vou te deixar
Eu quero e mais te amar
E ter você pra sempre do meu lado
Tudo o que eu sempre quis foi te fazer feliz
E ser pra sempre o seu namorado
Volta fica pra sempre do meu lado
Que ainda sou aquele homem apaixonado
Que te perdeu
E hoje reconheceu que o erro foi só meu"
Sim ou Não?,"Hoje todo mundo vai saber
Quem é que está ligando pra você
Sei que você não quer atender
Mas é alguém que gosta de você

Não, não custa nada não, ouvir a voz do coração
Que está sofrendo, está morrendo
Não, não custa nada, ele só quer uma namorada
Ele falou que te ligou, mas você não quis atender

Hoje todo mundo vai saber
Quem é que está ligando pra você
Sei que você não quer atender
Mas é alguém que gosta de você

Não, não custa nada não, ouvir a voz do coração
Que está sofrendo, está morrendo
Não, não custa nada, ele só quer uma namorada
Ele falou que te ligou, mas você não quis atender

A paixão bateu em sua porta sem te avisar
Sim ou não você decide agora o que vai falar

""alô, alô quem é?
Sou eu!
Eu quem?
A pessoa que está te ligando à vários dias
O que é que você quer comigo?
Tenho uma coisa muito importante pra te falar
Diga: aonde eu posso te encontrar? ""

Não, não custa nada não, ouvir a voz do coração
Que está sofrendo, está morrendo
Não, não custa nada, ele só quer uma namorada
Ele falou que te ligou, mas você não quis atender

A paixão bateu em sua porta sem te avisar
Sim ou não você decide agora o que vai falar
A paixão, sim ou não!"
Simbora Mô,"Cê quer ir mais eu mô, simbora
Cê quer ir mais eu mô, vamo agora
Cê quer ir mais eu mô, vem chegando
Vem me namorar que eu to te esperando

Assistindo um filme de romance na tv
Na cena de um beijo imaginei eu e você
Curtindo a madrugada de mãos dadas por ai
Estou ligando pra gente sair

Que tal nós dois na beira da praia
Se amando no clarão da lua
Nós dois rolando na areia
Você na minha e eu na sua

Cê quer ir mais eu mô, simbora
Cê quer ir mais eu mô, vamo agora
Cê quer ir mais eu mô, vem chegando
Vem me namorar que eu to te esperando
Cê quer ir mais eu mô, simbora
Cê quer ir mais eu mô, vamo agora
Cê quer ir mais eu mô, vem chegando
Vem me namorar que eu to te esperando

Assistindo um filme de romance na tv
Na cena de um beijo imaginei eu e você
Curtindo a madrugada de mãos dadas por ai
Estou ligando pra gente sair

Que tal nós dois na beira da praia
Se amando no clarão da lua
Nós dois rolando na areia
Você na minha e eu na sua

Cê quer ir mais eu mô, simbora
Cê quer ir mais eu mô, vamo agora
Cê quer ir mais eu mô, vem chegando
Vem me namorar que eu to te esperando
Cê quer ir mais eu mô, simbora
Cê quer ir mais eu mô, vamo agora
Cê quer ir mais eu mô, vem chegando
Vem me namorar que eu to te esperando
Cê quer ir mais eu mô, simbora
Cê quer ir mais eu mô, vamo agora
Cê quer ir mais eu mô, vem chegando
Vem me namorar que eu to te esperando

Cê quer ir mais eu mô, simbora
Cê quer ir mais eu mô, vamo agora
Cê quer ir mais eu mô, vem chegando
Vem me namorar que eu to te esperando"
Só Não Diga Bye Bye,"Só não diga bye bye, não não
Não me faça sofrer, ié ié
Só não diga bye bye, não não
Não me faça sofrer

Por onde será que anda você?
Eu não sei!
Faz tanto tempo que a gente não se vê!
Eu pensei!

Eu guardo tantas lembranças comigo
Lembra da primeira vez?
De vez em quando ainda sonho contigo
Por tudo que a gente fez

Estou carente
Você não sente, mas vou dizer
Fala comigo
Diz qualquer coisa só por dizer

Só não diga bye bye, não não
Não me faça sofrer ié ié
Só não diga bye bye, não não
Não me faça sofrer

Por onde será que anda você?
Eu não sei"
Só Sei Que Eu Te Amo,"Porque eu te amo, estou desesperada,
Nunca entendi porque você não me quis,
Sem seu amor, sou planta sem raiz.

Tô mentindo, se eu disser que sem você
A vida segue igual, está tudo como antes
Que meus dias já estão normais.
Ainda me incomoda, te encontrar com outro,
Não é o que eu quero, morro pouco a pouco,
Não vou olhar no espelho, e quero me enganar.

Porque eu te amo, estou desesperada,
Nunca entendi porque você não me quis,
Sem seu amor, sou planta sem raiz.
Porque eu te amo, estou abandonada,
Eu faço tudo pra poder te tocar,
E ao seu lado outra vez despertar.

O seu cheiro estar presente em cada coisa
Aqui ao meu redor, não há distância em
Pensamento, que te arranque do meu coração.
Recordo cada estante que vivi contigo,
Viver sem seu amor te juro é um castigo,
Volta pra mim novamente, eu te peço perdão.

Porque eu te amo, estou desesperada,
Nunca entendi porque você não me quis,
Sem seu amor, sou planta sem raiz.
Porque eu te amo, estou abandonada,
Eu faço tudo pra poder te tocar,
E ao seu lado outra vez despertar.

Ainda me incomoda, te encontrar com outro,
Não é o que eu quero, morro pouco a pouco,
Não vou olhar no espelho, e quero me enganar.
Recordo cada estante que vivi contigo,
Viver sem seu amor te juro é um castigo,
Volta pra mim novamente, eu te peço perdão.

Porque eu te amo, estou desesperada,
Nunca entendi porque você não me quis,
Sem seu amor, sou planta sem raiz.
Porque eu te amo, estou abandonada,
Eu faço tudo pra poder te tocar,
E ao seu lado outra vez despertar.

Porque eu te amo, estou desesperada,
Nunca entendi porque você não me quis,
Sem seu amor, sou planta sem raiz."
Só Tenho Olhos Pra Voce,"Só tenho olhos pra voce
E mais ninguem
O amor que sinto por voce
Ninguem tem
Existe alguem que te ama
E te quer tão bem
Esse alguem que a ama
Sou eu também
Não sai dos meus pensamentos
Os melhores momentos
O tempo que passamos juntos
Foi mais que 5 minutos

Te amo
Te quero também
Só existe pro meu coração
É voce meu bem
Te amo
Te quero também
Sou o seu apaixonado
Não quero mais ninguem"
Só Um Amor,"Uso o pé na estrada
Nessa minha vida errada
Eu queria encontrar
Um amor

Eu perguntei ao sol
Eu perguntei ao mar
Onde posso encontrar
Um amor

Eu vou seguindo a luz
A luz que me conduz
Agora estou na cruz
Por um amor

Andei à toa hoje eu sei
Me perdoa se eu errei
Eu só preciso ter
Um amor

Amor, amor, amor...
O teu amor"
Só Você Me Faz Feliz,"Com você, meu amor
Com você, eu vou pra qualquer lugar
È só você me chamar

Só você me faz feliz
Com você me sinto bem
Meu amor, eu te amo
Eu te quero tanto bem

Só você me faz feliz
Com você me sinto bem
Meu amor, eu te amo
Eu te quero tanto bem

Me deita na cama
Me abraça, me ama
Me faz sonhar, me faz delirar
Com você

Com você, meu amor
Com você, eu vou pra qualquer lugar
È só você me chamar

Com você, meu amor
Com você, eu vou pra qualquer lugar
È só você me chamar"
Sou Assim E Não Vou Mudar,"Melhor assim, sinto muito se você não acredita em mim
Pense o que você quiser que eu não tô nem aí
A opinião dos outros pra mim tanto faz
Depois não volte atrás
Não, não invente jogo sujo com o meu coração
Pense antes de tomar alguma decisão
Não vem com esse papo que eu não gosto de você
Não vai me convencer
Te amo e você sabe, tô te pedindo, pare
Se não você vai me perder pra sempre, de verdade
Confesso que cansei, eu nunca te enganei
Mas se você quiser tem sempre a primeira vez
Sou assim, não vou mudar
Essa é minha verdade, o meu jeito de amar
Faça o que quiser de mim, faça o que você quiser
Se me quiser vai ser assim, não do jeito que você quer
Sou assim, não vou mudar
Essa é minha verdade, o meu jeito de amar
Faça o que quiser de mim, essa é minha opinião
Se não acredita em mim, está livre o meu coração"
Sou Brinquedinho Caro,"Sonhar não custa nada
Não posso te dar mole
Sou brinquedinho caro
E me manter você não pode
Se não aguenta mais
Não chore
Sou brinquedinho caro
Me manter você não pode

Quase que você foi meu grande amor
Eu disse quase que meu coração se ferrou
Que pena que você não tenha grana
Quem sabe um dia você me ganha

Você se enganou ao meu respeito
Você falou demais eu não aceito
Homem não fala mais e acontece
Agora mostra aí que me merece

Sonhar não custa nada
Não posso te dar mole
Sou brinquedinho caro
E me manter você não pode
Se não aguenta mais
Não chore
Sou brinquedinho caro
Me manter você não pode

Quase que você foi meu grande amor
Eu disse quase que meu coração se ferrou
Que pena que você não tenha grana
Quem sabe um dia você me ganha

Você se enganou ao meu respeito
Você falou demais eu não aceito
Homem não fala mais e acontece
Agora mostra aí que me merece"
Sou Maluco Por Você,"Ma, maluco eu sou
Sou maluco por você amor
Ma, maluco eu sou
Sou maluco por você amor

Eu não vivo um minuto sem você
A saudade tá no peito faz doer
Me entreguei de corpo e alma a essa paixão
Tenho medo de perder seu coração

Eu não vivo um minuto sem você
A saudade tá no peito faz doer
Me entreguei de corpo e alma a essa paixão
Tenho medo de perder seu coração

Esse seu jeito provocante
Sua beleza natural
Sou namorado, sou amante
Do seu jeito meigo, doce e sensual

Ma, maluco eu sou
Sou maluco por você amor
Ma, maluco eu sou
Sou maluco por você amor

Ma, maluco eu sou
Sou maluco por você amor
Ma, maluco eu sou
Sou maluco por você amor"
Sou Seu Amor,"Sou seu amor, sou seu amor, é você que eu amo,
Sou seu amor, nããão, ainda não sou seu,
Mas quero te falar, que é você que eu amo,
Entããão, vim te procurar, te falar de amor, pra
Você me dar valor, um pouco mais que um sonho,
Um filme de amor, quero ter você, seja como for
Sou seu amor, sou seu amor, é você que eu amo,
Sou seu amor
Sei, é você que me tira o sono, quero ter você,
Seja como for"
Stéreo Love,"Pode me tocar, me fazer suar
Você pode fazer tudo
Faz o que eu preciso
Faz amor comigo
Não me deixa a perigo

Não posso negar que me fez sonhar
Que eu gostei de você
Que eu amo vocÊ

Por que faz partir o meu coração?

Amor não é mentira eu quero te ver
Liga logo pra mim, não deixa esperar
Liga logo pra mim, não faça chorar
Liga logo pra mim, venha logo me amar

Por que faz partir o meu coração?
Meu Amor, meu amor, eu te amo."
Tá Estourado,"Tá todo mundo ligado no estouro que chegou
Quem não tiver estourado, no forró não tem valor
Vai correndo, de seus pulos, se você quer estourar
Cante aí qualquer doideira
É sucesso vai pegar
Se você falar tá no fã clube
tá Estourado
Mas se falar de cabaré
tá Estourado
Mas se falar que é cachaceiro
tá Estourado
Se falar que tem dinheiro
tá Estourado
Se tá na boca do Povão
tá Estourado
Põe pra tocar no Paredão
tá Estourado
Se eu falar que sou Calcinha Preta
tá Estourado
Eu saio na televisão
tá Estourado

tá todo mundo ligado no estouro que chegou
Quem não tiver estourado, no forró não tem valor
Vai correndo, de seus pulos, se você quer estourar
Cante aí qualquer doideira
Esse sucesso vai pegar

Se tá pegando as Piriguetes
tá Estourado
Se tá na palma da mão
tá Estourado
Ganhar dinheiro no Forró
tá Estourado
Você não vale nada mas eu gosto de você
tá Estourado
Pegou, Ficou e Madeirou
tá Estourado
Bebeu, Caiu e Levantou
tá Estourado
tá arrastando a multidão
tá Estourado
Calcinha Preta na novela
tá Estourado

tá todo mundo ligado no estouro que chegou
Quem não tiver estourado, no forró não tem valor
Vai correndo, de seus pulos, se você quer estourar
Cante aí qualquer doideira
Esse sucesso vai pegar

Se você tá no fã clube
tá Estourado
Mas se falar de cabaré
tá Estourado
Mas se falar que é cachaceiro
tá Estourado
E se falar que tem dinheiro, pai
tá Estourado
Se tá na boca do Povão
tá Estourado
Põe pra tocar no Paredão
tá Estourado
E se eu falar que sou Calcinha Preta
tá Estourado
Eu saio na televisão
tá Estourado

Se tá pegando as Piriguetes
tá Estourado
Se tá na palma da mão
tá Estourado
Ganhar dinheiro no Forró
tá Estourado
Você não vale nada mas eu gosto de você
tá Estourado
Pegou, Ficou e Madeirou
tá Estourado
Bebeu, Caiu e Levantou
tá Estourado
tá arrastando a multidão
tá Estourado
Calcinha Preta na novela
tá Estourado"
Tanto Amor Que Eu Te Dei,"Tanto amor que eu te dei
Tantos sonhos que sonhei
Te perdi como um dia que passou

nem vestígios, encontrei
Nos lugares onde andei
Só restou meu amor por você

Será que existe em algum lugar
Alguma porta onde eu possa te encontrar
Um arco íris, um sinal no céu
Alguma pista do teu cheiro numa brisa calma
Que me leve até você

Mas um lindo sol ainda surgirá
Por trás da escuridão do meu olhar
A minha estrela-guia vai brilhar
E o vento vai soprar

Levando tanto amor que eu te dei
As noites que sozinha te esperei
No frio crucial da solidão
Me traz seu coração"
Tchau pro seu amor,"Você não me deu uma vida de princesa
Eu fechei no dez a dez mas você não deu valor
Achou que eu tava de brincadeira
Quando eu falei pra você que o nosso lance acabou
Quando eu falei pra você que o nosso lance acabou

Agora é tchau pro seu amor, tchau pra ilusão
Cansei de sofrer eu tô de volta no bailão
Agora é tchau pro seu amor, tchau pra ilusão
Cansei de sofrer eu tô de volta no bailão

Tchau, tchau, tchau, pra ilusão
Cansei de sofrer eu tô de volta

Eu te dei foi uma vida de princesa
E eu fechei no dez a dez mas você não deu valor
Achou que eu tava de brincadeira
Quando eu falei pra você que o nosso lance acabou
Quando eu falei pra você que o nosso lance acabou

Agora é tchau pro seu amor, tchau pra ilusão
Cansei de sofrer eu tô de volta no bailão
Agora é tchau pro seu amor, tchau pra ilusão
Cansei de sofrer eu tô de volta no bailão

Agora é tchau pro seu amor, tchau pra ilusão
Cansei de sofrer eu tô de volta no bailão
Agora é tchau pro seu amor, tchau pra ilusão
Cansei de sofrer eu tô de volta no bailão"
Te Acho Tão Linda,"É madrugada
e eu estou tão sozinho
To precisando de você junto a mim
Não sei o que você está fazendo agora
Se pensa em mim e chora, ou está nem aí

O que sinto por você é amor
Me desculpa por favor se eu te magoei
Eu nunca mais vou te deixar tão sozinha
Te acho tão linda
Por você me apaixonei

Eu queria te dar, as estrelas do céu e o mar
Poder te roubar pra ninguém te encontrar
Fazer uma canção de amor, cantar pra você
Eu te amo e jamais eu vou te esquecer"
Te Amo,"Te amo tanto, preciso desse amor
a tua ausência está doendo em mim...

Você nem sabe
Preciso desse amor
A tua ausência
Está doendo em mim
Vamos voltar
de novo ao sonho
Já não dá mais
Teus beijos, teu olhar

Eu não sei como apagar
Esse amor que vai além
do céu...

Oh... Te amo sempre te amei
Não te esqueci
Te amo sempre te amei
Preciso desse amor

(Um dia você vai voltar
Talvez eu não esteja mais aqui)

Vem aquecer
A nossa cama
Assim não dá
Preciso desse amor
Não me deixes mais
A tua ausência
Por Deus não vá
Vem me fazer feliz

Eu não sei como apagar
Esse amor que vai além
do céu...

Oh... Te amo sempre te amei
Não te esqueci
Te amo sempre te amei
Preciso desse amor"
Te Amo Demais,"Te amo demais, quanto mais amo eu quero mais
Estou perdidamente louco por você
Te amo demais

Ai menina linda quero um beijo
Antes que o sol te carregue de mim
Tô sozinho, preciso do seu amor, não faz assim.

Ai amor eu morro de ciúmes
Quando você me fala de outro alguém
Mas o seu coração
É meu, só meu e de mais ninguém

Te amo demais, quanto mais amo eu quero mais
Estou perdidamente louca por você
Fui o alvo do cupido desse teu amor
Te quero mais demais, quanto mais sofro eu quero mais
Estou perdidamente louco por você
Te amo demais

Ai amor, Ai amor..
Te amo demais"
Te Amo Tanto,"Te amo tanto
faz amor denovo comigo
você é tudo que eu preciso
amor eu preciso de você

ah sem você é uma loucura
é um vazio é uma tortura
sem você não consigo dormir

eu amor te amo tanto
vê se entende o meu pranto
você foi feita só pra mim
hoje eu sei
que minha vida sem você não tem sentido
te amo tanto é desse amor que eu preciso
volta correndo não me deixe mais sofrer

(refrão 1)
te amo tanto
faz amor denovo comigo
você é tudo que eu preciso
assim eu não consigo viver
te amo tanto
eu quero ter você toda hora
me ame mais não vá embora
amor eu preciso de você"
Te Quero Namorar,"AI, AI, QUE FAÇO NESSA HORA
SEM VOCÊ NÃO SEI O QUE FAZER
TODO DIA EU SONHO COM VOCÊ
AI, ME DÁ UMA SOLUÇÃO
AI, ME DÁ UMA SOLUÇÃO
AI, AI, O QUE FAÇO NESSA HORA
SEM VOCÊ NÃO SEI O QUE FAZER
TODO DIA EU SONHO COM VOCÊ
AI, ME DÁ UMA SOLUÇÃO
AI, ME DÁ UMA SOLUÇÃO
VEM CÁ QUE EU FICO COM VOCÊ
ME DÁ UMA NOITE DE PRAZER
VOU GRITAR QUE EU AMO VOCÊ
EU TE QUERO TANTO
EU TE QUERO NAMORAR
TE QUERO NAMORAR
TE QUERO NAMORAR
TE QUERO NAMORAR
TE QUERO NAMORAR
É MINHA ... A CALCINHA PRETA É SUA ... A CALCINHA PRETA"
Tem Mais Alguem,"- O oo Oooo Ooooo na há só... Nós.... dois
E mais alguém
Foi armadilha do amor
Eu não fui atrás (eu não fui atrás)
Não seria capaz
A paixão e sempre assim
Vem sem avisar
- Eu não vou amar alguém
Que me faça versos e promessas
Eu só quero encontrar alguém
Com sentimento puro
Não eu não desejo mais amar ninguém
Que me faça versos e promessas
Quero agora encontrar alguém
Que não me diga eu juro Ooohooo

- Sim eu te jurei
Ser só seu só e de mais ninguém
Eu não fui atrás (Eu não fui atrás)
Mais seria capaz (mais seria capaz)
Sem querer perdi o mundo baby só amor quem faz

- Mas eu não vou amar alguém
Que me faça versos e promessas
Eu só quero encontrar alguém
Com sentimento puro
Não eu não desejo mais amar ninguém
Que me faça versos e promessas
Quero agora encontrar alguém
Que não me diga eu juro Ooohooo

- Não pense que eu pinto o céu
Eu não sou anjo sou normal
Baby es o meu viver
Eu me perdi, mas não quero perder você
Não pense que eu sou de pedra
Errei mas, por favor, releva.

- Eu acho que não da pra mim

- (Pense bem)

- Eu não vou amar alguém
Que me faça versos e promessas
Eu só quero encontrar alguém
Com sentimento puro
Não eu não desejo mais amar ninguém
Que me faça versos e promessas
Quero agora encontrar alguém
Que não me diga eu juro Ooohooo
Não dá não

- Pense bem

-Amor não da
- Pense bem My Love de mais uma chance ao nosso amor
-Na há na há na há
-De mais uma chance ao nosso amorrrr"
Tem Mas Alguem,"Não há só nós dois
Tem mais alguém,
Foi armadilha do amor
Eu não fui atrás, não seria capaz
A paixão é sempre assim, vem sem avisar

Eu não vou mais amar ninguém
Que me faça versos e promessas
Eu só quero encontra alguém
Com sentimento puro

Não, eu não desejo mais ama ninguém
Que me faça versos e promessas
Quero agora encontrar alguém
Que não me diga, eu juro

Sim, eu te jurei
Ser só seu, só e de mais ninguém
Eu não fui atrás
Não seria capaz
Sem querer perdir o rumo
Baby, seu amor quem faz

Eu não vou mais amar ningúem
Que me faça versos e promessas
Quero agora encontrar alguém
Com sentimento puro

Não, eu não desejo mais ama ninguém
Que me faça versos e promessas
Quero agora encontrar alguém
Que não me diga, eu juro

Não pense que vim do céu
Eu não sou anjo, sou normal
Baby, és o meu viver
Eu me perdir, mas não quero perder você

Não pense que eu sou de pedra
Errei, mas por favor releva

Eu acho que não dá pra mim
Pense bem

Eu não vou mais amar ningúem
Que me faça versos e promessas
Quero agora encontrar alguém
Com sentimento puro

Não, eu não desejo mais ama ninguém
Que me faça versos e promessas
Quero agora encontrar alguém
Que não me diga, eu juro

Nã dá mais
Pense bem
Amor não dá
Pense, pense bem, my love
Dê mais uma chance ao nosso ao amor."
Tem Que Ser Você,"Um dia seus pés vão me levar
Onde as minhas mãos não podem chegar
Me leva onde você for
Estarei muito só sem o seu amor

Agora é a hora de dizer
Que hoje eu te amo
Não vou negar
Que outra pessoa não servirá

Tem que ser você
Sem por que, sem pra que
Tem que ser você
Sem ser necessário entender

ahh...
uhh...

Me leva onde você for
Estarei muito só sem o seu amor

Agora é a hora de dizer (de dizer... eh...)
Que hoje eu te amo
Não vou negar
Que outra pessoa não servirá

Tem que ser você
Sem por que, sem pra que
Tem que ser você
Sem ser necessário entender

Que hoje eu te amo
Não vou negar
Que outra pessoa não servirá

Tem que ser você
Sem por que, sem pra que
Tem que ser você
Sem ser necessário entender"
