SName,LyricAquela Noite,"eu sei que nao lembra mais de mim
mais isso pode deixar pra mim
o meu nome voce esqueceu mais isso so mim faz lembrar o seu
sei que esqueceu tudo mais eu nao
te guardo no meu coraçao
eu jamais vou te esquecer porque se alegria for humana a minha so pode ser voce
...eu preciso ouvir a sua voz
porque nao atende o telefone
nao deixe o meu coraçao partido
por chamar seu nome....
aquela noite encantada que passei com voce
uma mulher realizada julieta e romeu
lembro da nossa dispedida quando voce mim disse adeus
se foi e so deixou o telefone
mas...........
nunc atendeu
.... eu preciso(refrao)"
Armadilha,"eu não sei mais o que fazer com essa solidão
tá tudo fora de controle, fora do lugar
meu coração não pára de chorar
eu não consigo me livrar dessa armadilha
parece até que foi mandinga pra eu não te deixar
escrava desse amor
do teu beijo
e logo eu que era apaixonada por você
mas sua indiferença
fez me entregar
a outro alguém
de corpo e alma

você vacilou
você não deu valor
a esse amor que era só seu
que pena
você vacilou
você não deu valor
não foi capaz de me amar
como eu te amei

eu não sei mais o que fazer com essa solidão
tá tudo fora de controle, fora do lugar
meu coração não pára de chorar
eu não consigo me livrar dessa armadilha
parece até que foi mandinga pra eu não te deixar
escrava desse amor
do teu beijo
e logo eu que era apaixonada por você
mas sua indiferença
fez me entregar
a outro alguém
de corpo e alma

você vacilou
você não deu valor
a esse amor que era só seu
que pena
você vacilou
você não deu valor
não foi capaz de me amar
como eu te amei

quando estou te esquecendo alguem fala
seu nome
sinto que dentro de mim você ainda
se esconde
quando cai a noite bate o desespero
eu abraço o travesseiro e imagino
que é você

você vacilou
você não deu valor
a esse amor que era só seu
que pena
você vacilou
você não deu valor
não foi capaz de me amar
como eu te amei

eu não sei mais o que fazer com essa solidão"
Arrasou,"Você
Com seu jogo de sedução
Me usou depois foi embora
Levando o meu coração

Até parece um ladrão
Daqueles filmes de cinema
Que rouba centena
Não foge da cena
Eu vim aqui te filmar

Quem mandou me amar?
Quem mandou me amar?
Quem mandou entrar em cena?

Quem mandou me amar?
Quem mandou me amar?
Quem mandou entrar na minha?

Arrasou com meu coração
Mandou no pedaço
Estou em teus braços [tris]

Arrasou com meu coração
Mandou no pedaço
Estou presa nas suas mãos"
Arreia Cerveja,"Arreia cerveja que eu quero beber
Arreia cerveja que eu quero esquecer
Os olhos dela o perfume dela eu quero esquecer
Arreia cerveja que eu quero beber
Arreia cerveja que eu quero esquecer
E se eu passar mal e baixar no hospital deixa logo eu morrer

Calcinha preta !!!

Sou assim passo a noite largado na rua
Doido pirado de quina pra lua
Tentando esquecer uma louca paixão
Eu sou assim apaixonado pelos bares da vida
Bebendo e chorando por essa bandida
Que fez tanto estrago em meu coração
E cada vez que eu ligo o som do carro uma canção me traz
Boas lembranças de você aí eu bebo mais
Eu fico entregue as baratas sem êra e nem bêra
E a bebêdera é pesada e só acaba se eu caí no chão
Garçom me traga o remédio pra essa solidão
Que eu vou curar minha tristeza hoje aqui na mesa

Arreia cerveja que eu quero beber
Arreia cerveja que eu quero esquecer
Os olhos dela o perfume dela eu quero esquecer
Arreia cerveja que eu quero beber
Arreia cerveja que eu quero esquecer
E se eu passar mal e baixar no hospital deixa logo eu morrer

Calcinha preta !!!

E cada vez que eu ligo o som do carro uma canção me traz
Boas lembranças de você aí eu bebo mais
Eu fico entregue as baratas sem êra e nem bêra
E a bebêdera é pesada e só acaba se eu caí no chão
Garçom me traga o remédio pra essa solidão
Que eu vou curar minha tristeza hoje aqui na mesa

Arreia cerveja que eu quero beber
Arreia cerveja que eu quero esquecer
Os olhos dela o perfume dela eu quero esquecer
Arreia cerveja que eu quero beber
Arreia cerveja que eu quero esquecer
E se eu passar mal e baixar no hospital deixa logo eu morrer...

Arreia cerveja que eu quero beber
Arreia cerveja que eu quero esquecer
Os olhos dela o perfume dela eu quero esquecer
Arreia cerveja que eu quero beber
Arreia cerveja que eu quero esquecer
E se eu passar mal e baixar no hospital deixa logo eu morrer..."
Até na Lua,"Eu, vim da lua, nas asas de um trovão,
Prá dançar com o calcinha,
E conquistar teu coração.

Não sou daqui, mas vim para ficar,
Vou vestir tua calcinha,
Por aí vou desfilar.

Calcinha preta,
No momento é a sensação,
Realça teu corpo inteiro,
Me arrepia de tesão.

Se um dia voltar,
Prá lua eu vou levar,
A calcinha preta comigo,
E prá sempre adorar."
Balada Prime,"Que cara de pau a sua, me ligar de madrugada
Depois de tudo que me fez, não dar pra acreditar
E ainda quer ficar comigo e outra vez tentar me dominar
Com seu veneno

Lembra dos lugares, festas e viagens que eu deixei de ir
Por causa de você
Lembra daquela amiga gata que você me apresentou?
É com ela que eu tou fazendo amor

Perdeu seu time, time quer me encontrar
Vai na balada prime, na área vip
Com as top derramando uísque, vodka e Chandon

Perdeu seu time, time quer me encontrar
Vai na balada prime solteiro
Em ninguém pra atrapalhar e você de blá, blá, blá
Perdeu seu tempo tchau, vou desligar

Os melhores cantores"
Balançando O Brasil,"Ao vivo e a cores é o DVD
É mais alegria pra mim e pra você
É felicidade que nunca se viu
É Calcinha Preta balançando o Brasil

Balançando, balançando,
balançando a multião
Quero ver você mexer
É calcinha meu irmão
Quero ver você mexer
É calcinha meu irmão

Balançando, balançando,
balançando a multidão
Quero ver você...
bater na palma da mão
Quero ver você...
bater na palma da mão

Eu sinto falta de vocês
Infarta o coração
Sou seu namorado
Te quero ao meu lado
É calcinha meu irmão

Eu sinto falta de vocês
Infarta o coração
Sou seu namorado
Te quero ao meu lado
É calcinha meu irmão"
Balanço do Amor,"Me leve ao balanço do amor
Siga seu coração por onde for
Não quero mais saber de solidão
Você mexeu comigo
Ganhou meu coração

Esquente seu corpo no meu
No balanço do amor
Quero estar com você
Não importa onde for ...
Vem me amar, Vem dançar
Vou te dar, te dar amor

Me leve ao balanço do amor
Siga seu coração por onde for
Não quero mais saber de solidão
Você mexeu comigo
Ganhou meu coração

Me leve ao balanço do amor
Siga seu coração por onde for
Não quero mais saber de solidão
Por que calcinha preta tá no meu coração."
Bebida Danada,"Ai, ai, ai, ai
Ai, ai, ai, ai

Num baile de forró
Me chamou pra dançar
Depois de um bom papo
Começamos namorar
Tomei uma bebida
E a danada me pegou
Acordei assustada
Meu Deus onde é que eu tô

Num quarto de motel
Um oásis de amor
A tal felicidade
Parece que chegou
A minha danadinha
Não queria mais parar
Regando a minha flor
Gritei de tanto amar

Ai, ai, ai, ai
Ai, ai, ai, ai"
Bebo E Choro,"Eu choro, feito um menino chorão
Bebo, pra sair da solidão
Eu tenho que arrumar um jeito pra esquecer

Ando tão amargurado
Sem você do lado pra me dar amor
Por que você deixou
Esse cara que te ama
E te fez na cama ser uma mulher
Por que me abandonou

Eu deixei os meus amigos por você
Deixei de jogar baralho e de beber
Te amar demais foi o meu erro
Feito um bobo entreguei meu coração
E em troca recebi ingratidão

Eu choro, apaixonado por você
Bebo, pra tentar te esquecer
Eu tô desmantelado sem o seu amor

Eu choro, feito um menino chorão
Bebo, pra sair da solidão
Eu tenho que arrumar um jeito pra esquecer"
Beijar Por Beijar,"Tá um disse e me disse lá na rua
Sobre que você tem outra figura
Ô negona quer me sacanear
Tá ligada que eu parei na sua
Você me prometeu o céu e a lua
E no final do mundo se casar

Fique sabendo, não sou brinquedo
Se não der uma explicação
Eu me entrego a outra paixão

Vou sair pra namorar
Vou beijar só por beijar
Ninguem vai me segurar
Vou sair pra namorar
Vou beijar só por beijar
A primeira que Passar

Tá um disse e me disse lá na rua
Sobre que você tem outra figura
Ô negona quer me sacanear
Tá ligada que eu parei na sua
Você me prometeu o céu e a lua
E no final do mundo se casar

Fique sabendo, não sou brinquedo
Se não der uma explicação
Eu me entrego a outra paixão

Vou sair pra namorar
Vou beijar só por beijar
Ninguem vai me segurar
Vou sair pra namorar
Vou beijar só por beijar
A primeira que Passar

Se isso é verdade meu, amor
Sabe o que é que eu vou fazer
Pra sair dessa deprê
Vou beijar muito

Vou sair pra namorar
Vou beijar só por beijar
Ninguem vai me segurar
Vou sair pra namorar
Vou beijar só por beijar
A primeira que Passar

Tá um disse e me disse lá na rua
Sobre que você tem outra figura
Que onda é essa negona, pode explicar?"
Beijo de Língua,"Sou uma flor tão delicada
Mas se quiser o meu amor
Tem que ter pegada

As vezes sou sentimental
Mas hoje eu quero, sexo animal
Porque eu sou assim, porque eu sou assim
Comigo não tem tempo ruim
Porque eu sou assim, porque eu sou assim
Tudo rola quando eu tô afim

Não quero selinho, não sou mais menina
Só quero se for, um beijo de língua
Não quero um abraço,vem me dar um laço
Só quero se for, se for um amasso"
Beijo Molhado,"Sinto a falta do teu
beijo molhado
Do teu corpo suado,
toque das tuas maos

Sinto a falta do teu
jeito safado
Que abala o meu corpo
e o meu coração

Preciso sentir o sabor
de tua boca
Vem me deixar louca
Me fazer sonhar

Preciso sentir muito mais
que um desejo
Pois, quando eu te vejo
So penso em te amar

Eu quero fazer amor com você
Vem me tocar
Vem me abraçar
Me fazer mulher

Eu quero sentir todo prazer
Vem me amar
Depois viajar
Pelas estrelas

Com você, você..."
Ben (homenagem A Michael Jackson),"Ben, já soube que você se foi
Que saudade que em mim ficou
Vi você nasceu o amor a quem mais precisou
O quanto fez sorrir
Você nos fez feliz
Ben, o mundo chora por você
De repente nos surpreendeu
vi os fãs por ti orar querendo te salvar
Seu coração parou e o sonho terminou
Agora eu sei, doi em mim
Você se foi, infeliz
Agora eu sei, doi em mim, Você se foi, infeliz
Ben, já soube que você se foi
que saudade que em mim ficou
Vi você nasceu o amor, a quem mais precisou
O quanto fez sorrir
Você nos fez feliz
Ben, o mundo chora por você
De repente nos surpreendeu
Vi os fãs por ti orar, querendo te salvar
Seu coração parou e o sonho terminou
Agora eu sei doi em mim, você se foi infeliz
Agora eu sei doi em mim, você se foi infeliz."
Cabelo Loiro,"É você meu verdadeiro amor
Vou com você aonde for

Foi como sol surgindo na escuridão
Raio de luz que clareou meu coração
Acendeu meu amor dentro da minha alma
Você chegou pra mim na hora exata
Descretamente sem me avisar
Fui surpreendido pelas ondas desse mar

Agora minha vida é sua vida
Te dar prazer é meu maior prazer
Te amo demais sou louco por você

Louco pirado nesse seu cabelo loiro
No seu olhar que atrai o meu desejo
E faz meu pensamento flutuar
Por isso meu amor que eu sou
Louco pirado nesse seu cabelo loiro
No toque na malícia dos seus dedos
Deixando o meu corpo em tentação
Pegando fogo de paixão"
Cada Paixão Uma Novela,"Um beijo de amor
Um grito de dor
Amores que vem
Amores que vão
E o meu coração
Sempre à tua espera
Cada paixão uma novela

Sou assim
Eu vivo me entregando às paixões
Mas o meu coração não desanima
Cada vez no beijo, o gosto
Que eu guardei dentro de mim
Pra sempre em mim

E foi assim
Que eu me entreguei de corpo e alma
Só pra você
Quis que me amasse como eu te amo
Mas todo amor chega ao fim
E o que é que eu vou fazer

Um beijo de amor
Um grito de dor
Amores que vem
Amores que vão
E o meu coração
Sempre à tua espera
Cada paixão uma novela"
Calcinha Eu Te Amo,"Calcinha eu te amo
Tudo o que eu faço é por esse amor
Calcinha eu te amo Só tenho olhos pra você
Tá no meu coração, na letra da canção
Calcinha eu te amo

Com você eu me aqueci ouvindo cobertor
Só você me faz feliz o que é que eu vou fazer
Não me deixe agora só você me faz feliz
Só assim não vou mudar escrava do amor

Fique no meu coração é seu amor que eu quero
Sonho lindo hoje à noite eu quero só você
Você é a lua e eu sou o sol, virei seu fã
Te acho tão linda
Seu amor é bom

Calcinha eu te amo
Tudo o que eu faço é por esse amor
Calcinha eu te amo Só tenho olhos pra você
Tá no meu coração, na letra da canção
Calcinha eu te amo
Calcinha eu te amo
Louca por ti amor da minha vida
Calcinha eu te amo
Meu vício, minha favorita
Quero gritar pra todo mundo ouvir
Não tem explicação, Calcinha eu te amo

O nosso amor virou manchete dos jornais
Campeão de bilheteria
Sucesso internacional
Duas paixões, dois amores
Parece que foi feita pra mim
Por isso eu canto assim
Eu faço tudo por você"
Calcinha Meteóro,"Eu acho que vou me apaixonar
A calcinha é gostosa e chegou para ficar...
E foi assim que começou a nossa historia de amor
Na batida desse som que você me confessou.
Então vem me enlouquecendo eu não pude revidar
Que a calcinha é gostosa e chegou para ficar
Eu acho que vou me apaixonar
A calcinha é gostosa e chegou para ficar
Eu acho que vou me apaixonar
Vou baixando
Vou mechendo e faço o povo delirar
Que loucura que me da eu não consigo desgrudar
A Calcinha manda ver e agita sem parar
Eu acho que vou me apaixonar
A calcinha é gostosa e chegou para ficar...
Eu que vou me apaixonar
A calcinha manda ver e agita sem parar
Eu acho que vou me apaixonar
A calcinha é gostosa e chegou para ficar...
Eu acho que vou me apaixonar
A Calcinha manda ver e agita sem parar
Eu acho que vou me apaixonar
Vou baixando
Vou mexendo e faço o povo delirar..."
Campeão de Bilheteria,"Tela branca e o projetor colorido
Vai passando cenas de uma paixão
Foram gastos mais de um milhão de beijos
Investidas varias formas de desejo
Premiados pelas vezes que fizemos amor
Por onde passa ele arrasta multidões
Ensinando aos corações a arte cênica do amor
E é por isso que ele já foi censurado
Indicado e aprovado até
Por quem nunca amou

Refrão

E esse filme é
Baseado na vida real
Que conta a história de um jovem casal
Loucamente apaixonado
Esse filme de amor
Que passa em minha mente todo dia
Já foi invejado e é considerado
Campeão de bilheteria

Por onde passa ele arrasta multidões
Ensinando aos corações a arte cênica do amor
E é por isso que ele já foi censurado
Indicado e aprovado até
Por quem nunca amou

Refrão

E esse filme é
Baseado na vida real
Que conta a história de um jovem casal
Loucamente apaixonado
Esse filme de amor
Que passa em minha mente todo dia
Já foi invejado e é considerado
Campeão de bilheteria

Vai passar pelas telas de hollywood
Enquanto a gente vai brincando de se amar
E ganhar o oscar de melhor ator
Na primeira arte divina do amor




by _R|¢k_"
Cena de Novela,"O nosso amor é cena de novela
Fico parada com você na tela.
O nosso amor é como estação
É tempestade chuva de verão
Calor e frio e alaga o meu coração.

O nosso amor é cena de novela
Fico parado com você na tela.
O nosso amor é como estação
É tempestade chuva de verão
Calor e frio e alaga o meu coração.

Essa saudade um dia ainda me mata
Eu tô perdida sem você aqui
Passe a borracha no que já passou
Agora é hora de viver amor
Quero sentir teu corpo quente todo em mim..

Assim não dá,vou mudar o meu rumo
Encontrar outro mundo,que eu possa viver sem sofrer

Não vou chorar,nem mostrar o que sinto
Mas juro eu não minto,esse amor no meu peito
ainda vai ficar...."
Chora,"A sua dor é resposta do que a gente já passou
Não venha me falar de sentimentos
Você não teve consideração comigo, não

Meu amor a gente tinha tanto tempo
Mas você não soube nem aproveitar
Não é assim que cura um ressentimento
Dessa relação não quero mais falar

Chora
Eu sei que lá no fundo você chora
Porque da sua vida eu fui embora
Então chora
Você não soube dar valor

Chora
Eu sei que lá no fundo você chora
Porque da sua vida eu fui embora
Então chora
Você não soube dar valor
Eu fui embora

Meu amor a gente tinha tanto tempo
Mas você não soube nem aproveitar
Não é assim que cura um ressentimento
Dessa relação não quero mais falar

Chora
Eu sei que lá no fundo você chora
Porque da sua vida eu fui embora
Então chora
Você não soube dar valor

Chora
Eu sei que lá no fundo você chora
Porque da sua vida eu fui embora
Então chora
Você não soube dar valor

Eu fui embora"
Cobertor,"Como é que você foi embora
Sem dizer pelo menos adeus
E fez sofrer tanto assim
Num coração apaixonado por você?

Como é que você depois liga
Pra dizer que esta arrependida
E foi embora, mas que vai voltar
Pedindo pro meu coração o seu lugar

Ah, ah, ah, que pena, o meu coração
Não é mais meu!
Mesmo que fosse nunca mais seria seu
Você se foi, nem quis saber se estava frio

Eu achei um cobertor
Que me deu tanto amor
E que nunca deixa o frio
Tomar conta de mim"
Código Das Vinte,"Mas eu amo só você
Você quem me faz feliz
A escolhida do meu coração

Ter vinte namoradas não é mole não
É muita adrenalina pro meu coração
Eu tive que encontrar um jeito
Assim fiz um disfarce pra ninguém notar
A fórmula secreta de não vacilar
O código das vinte eu criei pra me ajudar

A Dani quando liga eu digo que é engano
Karina quando liga é sempre a cobrar
A secretária diz que é bronca do trabalho
Roberta é uma mensagem no meu celular
Um toque é Ivete. São oito na internet
Aguenta coração
Maria é minha prima
O nome de Joana na agenda é João
As Gêmeas me procuram com o numero privado
Paulinha também liga assim, às vezes me atrapalho
A Claudia e a Sandrinha só respondem se eu falar
O código das vinte eu criei pra me ajudar

Mas eu amo só você
Você quem me faz feliz
A escolhida do meu coração
Mas eu amo só você
Você quem me faz feliz
As outras são apenas curtição"
Colchão e Cobertor,"Hoje vai chover amor, hoje vai chover paixão
Quero ser seu cobertor e você o meu colchão
Se arrume e se prepare fique linda, que hoje à noite
Eu vou te amar... Use aquela roupa e aquele perfume
E eu quero te devorar

Tô morrendo de vontade de te ver
Tô queimando de desejo por você
Vamos sair por ai, curti a noite inteira
Beijar, namorar, pra que ficar de bobeira
E quando a madrugada for se aproximando
Se prepare pra me amar

Hoje vai chover amor, hoje vai chover paixão
Quero ser seu cobertor e você o meu colchão
Tô morrendo de vontade de te ver
Tô queimando de desejo por você

Vamos sair por ai, curti a noite inteira
Beijar, namorar, pra que ficar de bobeira
E quando a madrugada for se aproximando
Se prepare pra me amar
Hoje vai chover amor, hoje vai chover paixão
Quero ser seu cobertor e você o meu colchão"
Com Você,"Só voce me faz feliz
com você me sinto bem
meu amor eu te amo
eu te quero tanto bem

me deita na cama
me abraça
e me ama
me faz sonhar
me faz delirar
com você

com você
meu amor
com você
eu vou pra qualquer lugar
e so você me chamar"
Como Eu Te Amei,"Quando ascendeu em mim o farol da paixão
Meus olhos navegaram em sua direção
Milhas e milhas de um cais
Em busca daquela paz
Que meu coração sonhou
Pensando que era amor
Eu me arrisquei demais
Deixei tudo para traz
E me lancei no mar de quem não soube amar

Te amei
Buscando os 7 mares
Te amei
Foi amor de verdade
Te amei, como eu te amei
Te amei
Como ninguém no mundo
Te amei
Sentimento profundo
Te amei, como eu te amei

Um dia você vai me procurar naquele mar
Por onde navegou o meu amor pra te encontrar
Aí vai se lembrar que por você eu naufraguei
Que o quanto nessa vida eu te amei

Te amei
Por todos 7 mares
Te amei
Foi amor de verdade
Te amei, como eu te amei
Te amei
Como ninguém no mundo
Te amei
Sentimento profundo
Te amei, como eu te amei"
Conta de Luz (Part. Wesley Safadão),"Já tava dando a volta por cima
Tinha que ter essa reviravolta
Meu sofrimento entrando por debaixo da porta

Quando eu abri a correspondência
Bateu um peso na minha consciência
Esse valor aqui dá pra pagar
O problema é o nome do titular

Como é que eu te esqueço?
Se a conta de luz ainda vem no seu nome
No meu endereço
Como é que eu te esqueço?"
Coração Bobo,"Tá escrito em sua testa
Que você ainda me ama
Tá na cara que você não me esqueceu
Se entregando em outros braços
Porém não foi o bastante
Pra provar que o meu amor é sua vida sua fonte

E na cama o teu cheiro me incomoda
Ligo o rádio e vou tentando te esquecer
E numa canção de amor faz lembrar o que passou
Sem saída eu me rendo a você
Não adianta fechar os olhos
Fazer de conta que não me vê

Não faz sentido o seu orgulho
Fala a verdade pra não sofrer
Te amo e não quero te perder
Não adianta os meus mistérios
Já fiz de tudo pra te esquecer
Não tem mais jeito tô de bobeira coração bobo pra ter você
Te amo e não quero te perder..."
Coração Vagabundo,"porque o coração da gente às vezes cega
e quando se dá conta
já se apaixonou
a gente sempre tenta ser duro na queda
mas quebra a cara quando sente que não e amor
agora diz meu coração o que eu vou fazer porque a ela
me entregou se era so prazer então se vira se
arrebrenta faz meu peito parar de sangrar ela me usou
vestiu a roupa e desapareceu como se fosse um programa
nem me disse adeus fugiu e me deixou aqui chorando
chorando





explode em meu peito um desejo
uma louca vontade de trazer ela pra perto de mim
pra matar a saudade
vai voar longe depressa
até o fim do mundo
vai coração vagabundo vai coração vagabundo"
De Tanto Te Querer,"Larga tudo e vem correndo
Vem matar minha vontade
Já faz tempo que eu tô sofrendo
Mereço um pouco de felicidade

Larga tudo e vem correndo
Pra eu mergulhar no teu sorriso
Me arranca desse inferno
Me leva pro seu paraíso

Eu não desisto do que eu quero, mas não me desespero
Te espero
Na tarde quente ou madrugada fria, na tristeza ou na
alegria

Ficar sozinha não rola, mas o amor não se implora,
nem se joga fora
O amor a gente conquista, e não há quem desista,
se o coração chora

Chora com vontade de te ver
Chora com saudade de você
Choro às vezes eu nem sei por que
Deve ser de tanto te querer

Iê, iê, iê, iê, iê
De tanto amar você"
Desfile de Moda,"Louco por ela eu sou, não posso mais negar...
Onde ela tá eu tou, onde ela vai eu vou, chego já!

Fim de semana tô aqui de novo
Na gritaria no meio do povo
É casa cheia pode apostar (calcinha preta)
É tanta gente bonita, é um desfile de moda
É tem homem muito gostoso
É muita mulher gostosa
Não perca essa festa vem pra cá (calcinha preta)

Por ela morro de tesão
É a dona do meu coração
Calcinha preta é paixão!

Refrão

Louco por ela eu sou,
Não posso mais negar,
Onde ela tá eu tou,
Onde ela vai eu vou chego já

Sou do fã clube, vou com ela em qualquer parte do brasil
Calcinha preta já me seduziu
Sou do fã clube, vou com ela seja em qualquer lugar
Calcinha preta vou te namora hohohoho (calcinha preta)"
Desilusão,"Não tenho culpa desse amor acontecer,
Foi você quem quis assim.
Sem você eu vou ficar na solidão
E magoar meu coração

Tudo começou na primeira vez que eu te vi.
Seu jeitinho de me olhar,
Seu jeitinho de falar,
Seu jeitinho de sorrir
O tempo foi passando não consegui te esquecer,
Onde quer que eu estivesse,
Qualquer coisa que eu fisesse
Só pensava em você.

Olha meu amor
Eu não posso aguentar
A maior desilusão é querer ter não conseguir

Não tenho culpa desse amor acontecer,
Foi você quem quis assim.
Sem você eu vou ficar na solidão
E magoar meu coração"
Digitais,"Você disse que nesse romance
Eu podia apostar
De repente você vai embora
Sem dizer adeus
E me deixa nesse apartamento
Sofrendo demais, demais
Apenas vivendo por viver
Dói demais, demais
Um segundo longe de você
E agora o que é que eu
Vou fazer da minha vida
Se cortar pela raiz essa paixão
Eu fiz de tudo pra você
Final da história
Quem pagou o pato foi meu coração
Não adianta se esconder
Fazer de conta que não vê
As digitais que ainda marcam o seu corpo
Eu tenho um mundo pra te dar
Aceso em luzes de paixão
Eu te amo, dono do meu coração
Não adianta se esconder
Fazer de conta que não vê
As Digitais
Que ainda marcam o seu corpo
Eu tenho um mundo pra te dar
Aceso em luzes de paixão
Eu te amo, dono do meu coração

POR GSM"
