SName,Lyric"Mariana, Adriana, Juliana","Mariananana, Adriananana, Juliananana
Eu quero ver você mexer

Mariananana, Adriananana, Juliananana
Eu quero ver você mexer
Mariananana, Adriananana, Juliananana
Se eu te pegar você vai ver

Vem gatinha linda vem pra cá
Vem dançar comigo vem fazer amor
Tchê Tchêrêrê Tchê Tchê
Tchererê Tchê Tchê
Tcherere Tchê Tchê

Vem gatinha linda vem pra cá
Vem dançar comigo vem fazer amor
Tchê Tchêrêrê Tchê Tchê
Tchererê Tchê Tchê
Tcherere Tchê Tchê

Pra elas todo dia é verão
Todo dia tem praia, praia
A vida a é boa é jet ski é cervejão
E a noite balada, balada

Sem me ama me prove
Se me odeia vá embora
Se me quer conquiste não jogue conversa fora
Prefere outra pessoa
Suma da minha frente
Comigo é assim minha pegada é diferente

Mariananana, Adriananana, Juliananana
Eu quero ver você mexer
Mariananana, Adriananana, Juliananana
Se eu te pegar você vai ver

Vem gatinha linda vem pra cá
Vem dançar comigo vem fazer amor
Tchê Tchêrêrê Tchê Tchê
Tchererê Tchê Tchê
Tcherere Tchê Tchê

Vem gatinha linda vem pra cá
Vem dançar comigo vem fazer amor
Tchê Tchêrêrê Tchê Tchê
Tchererê Tchê Tchê
Tcherere Tchê Tchê

Pra elas todo dia é verão
Todo dia tem praia, praia
A vida a é boa é jet ski é cervejão
E a noite balada, balada

Sem me ama me prove
Se me odeia vá embora
Se me quer conquiste não jogue conversa fora
Prefere outra pessoa
Suma da minha frente
Comigo é assim minha pegada é diferente

Tá combinado a gente vai ficar
A noite é nossa e tudo vai rolar

Mariananana, Adriananana, Juliananana
Eu quero ver você mexer
Mariananana, Adriananana, Juliananana
Se eu te pegar você vai ver

Mariananana, Adriananana, Juliananana
Eu quero ver você mexer
Mariananana, Adriananana, Juliananana
Se eu te pegar você vai ver"
Me Diz O Que Fazer,"Eu te chamo me diz o que fazer,
só sei dizer:Eu amo você.
Falando sério eu vim te ver.
Marquei um encontro com você.
Gosto mesmo, só eu sei.
Mesmo distante eu te amei.
Não sei seu nome, mas vim te ver.
Mesmo distante eu te amei.
Não saio daqui sem ao menos te sentir.
Mesmo que eu tenha que fugir."
Me Diz Onde Você Está?,"Me diz onde você está,
que eu vou correndo pra te ver
pra acabar com essa dor e mostrar que eu estou louca
por você.....
você me mostrou o paraiso
e a magia de amar
eu nem posso ver você sorrindo
em qualquer lugar que olhar
me fez esquecer os erros do passado
depois me deixou abandonada
eu sempre vivi um faz de conta num castelo de areia
e você me deu um mundo novo como o mar pra uma sereia
mais meu coração tem medo de amar
e agora decidida quero me entregar...
Me diz onde você está,
que eu vou correndo pra te ver
pra acabar com essa dor e mostrar que eu estou louca
por você....."
Me Ensina A Namorar,"Me ensina na
Me ensina a namorar
Um beijo bem gostoso eu vou te dar
Eu vou te dar

Me ensina na
Me ensina a fazer
Aquele amor gostoso com você...

Quantas vezes eu pensei
Em namorar você
Mas, não sei como fazer, iê...

Quantas vezes eu sonhei
Como te falar
Agora vou me declarar, a...

Cawboy você me ganhou
Laçou o meu coração

O que quiser eu te dou
Mas não me deixe na mão, uô, ô, ô...

Me ensina na
Me ensina a namorar
Um beijo bem gostoso eu vou te dar
Eu vou te dar

Me ensina na
Me ensina a fazer
Aquele amor gostoso
Que eu só quero com você...

Me ensina na
Me ensina a namorar
Um beijo bem gostoso eu vou te dar
Eu vou te dar

Me ensina na
Me ensina a fazer
Aquele amor gostoso com você..."
Me Joga No Google,"Me joga no google,me chama de pesquisa e diz que eu sou
tudo o que você procurava
Me joga no google,me chama de pesquisa e diz que eu
sou tudo o que você sempre quis

Fiquei sabendo,que você está à procura de um grande
amor
Um caso sério,alguém pra curtir a vida seja junto seja
como for (2x)

Olha pros lados,será que não está vendo a felicidade
pode estar bem perto de você

Me joga no google,me chama de pesquisa e diz que eu
sou tudo o que você procurava
Me joga no google,me chama de pesquisa e diz que eu
sou tudo o que você sempre quis(2x)

Acredite amor eu posso te fazer feliz"
Me Liga,"Onde está você?
Onde está você?
Porque fugiu de mim?
Apaixonada estou por você, amor
E hoje o dia está lindo

{Refrão}

Me liga
Me diz o que eu faço
Me diga que vêm me ver
Me liga
Me diz o que eu faço
Me leva com você

{2}

Vou te esperar
Sabe que eu te amo
venha me buscar
você vai ver
vou está tão linda, linda
Pra você

{Refrão}

Me liga
Me diz o que eu faço
Me diga que vêm me ver
Me liga
Me diz o que eu faço
Me leva com você

CALCINHA PRETA AO VIVO EM SÃO PAULO

Onde está você?
Onde está você?
Porque fugiu de mim?
Apaixonada estou por você, amor
E hoje o dia está lindo

Me liga
Me diz o que eu faço
Me leva com você
a noite vou dar
a noite vou dar amor pra você

Vou te esperar
Sabe que eu te amo
venha me buscar
você vai ver
vou está tão linda, linda
Pra você

Me liga
Me diz o que eu faço
Me diga que vêm me ver
Me liga
Me diz o que eu faço
Me leva com você

Com você eu vou [7x]"
Me Mande Um Recado,"Não Dá Pra Acreditar
Que Você Já Me Esqueceu
Os Dias Vão Passando
Cada Dia Vamos Nos Se Separando

Não Dá Pra Acreditar
Que O Seu Amor Por Mim
Já Se Acabou
Me Mande Um Recado?
Quero Saber A Verdade
Se Eu Sou O Seu Amor
Você Não É Mais Uma Criança
Pra Viver Com Blá Blá Blá

Me Liga Preciso Saber
Se Ainda Me Ama
Estou Aqui Vivendo Numa Premonição

Não Adianta Me Adular
Ainda Não Sei Se Eu Quero Você."
Medo de Amar,"Ta com medo de amar, é?
Ta com medo do amor, e aí?
Deixa a página virar, é?
Deixa o coração em flor se abrir

Quando eu te der um sorriso tu me dá um beijo
Vai virar sua cabeça, vai perder o medo
Tá com medo de amar, é?
Tá com medo do amor, e aí?
Deixa a página virar, é?
Deixa o coração em flor se abrir

Quando eu te der um sorriso tu me dá um beijo
Tudo em você é novo
Queima de desejo
Ta com medo de amar, é?
Ta com medo do amor, e aí?
Deixa a página virar, é?
Deixa o coração em flor se abrir

Vai beijando a minha boca, tirando a roupa
Como se fosse da primeira vez
Vai rolando um sentimento, num movimento
Num carinho que a gente fez

Quando eu te der um sorriso tu me dá um beijo
Vai virar tua cabeça, vai perder o medo
Tá com medo de amar, é?
Tá com medo do amor, e aí?
Deixa a página virar, é?
Deixa o coração em flor se abrir

Quando eu te der um sorriso tu me dá um beijo
Tudo em você é novo
Queima de desejo
Ta com medo de amar, é?
Ta com medo do amor, e aí?
Deixa a página virar, é?
Deixa o coração em flor se abrir

Vai beijando a minha boca, tirando a roupa
Como se fosse da primeira vez
Vai rolando um sentimento, num movimento
Num carinho que a gente fez"
Mesmo Assim,"Foram tantas coisas boas
Não posso te esquecer
O meu coração coitado
Nem pensa em te perder

Por isso não estrague o sonho
E trate de voltar pra mim

Volta que eute amo, baby
Não foge mais de mim, volta
Sim, que eu te amo, baby
Fica perto de mim, volta
Sim, que eu te chamo, baby
Eu te amo mesmo assim
Mesmo assim ou, ou, ou
Mesmo assim"
Meu Anjo,"Quando eu te vi
Não soube controlar meu coração
Eu fiquei assim, meio bobo
Mas chamei sua atenção
Sei que ela assim, sem jeito me falou
'quero você!'
Disse mais pra mim
Meu anjo sou sua fã'

Disse mais
Meu anjo te amo
Disse mais
Te amo, te amo

Quanto mais amor, você me der,
Eu vou ficar com você
Vou te amar, te respeitar"", te merecer
Quanto mais amor, você me der
Eu vou ficar com você
Vou te amar, te respeitar, te merecer
Vai me ganhar, você vai ver..."
Meu Primeiro Namorado,"E agora? e agora?
O que vou fazer sem teu amor?

Meu primeiro namorado foi você
Sete dias depois já me fez mulher
Em seguida disse que não me queria
Me senti menina e também mulher
Fiquei sozinha guardando meus segredos, se minha mãe descobrir será meu fim
Minha vida já não é como era antes, o meu corpo já começa a transformar

E agora? e agora?
O que vou fazer sem teu amor?

Arrumei uma viagem pra fugir
Pois minha mãe já começou desconfiar
Do meu jeito, do meu modo de vestir
Tem hora que ja não dá mais pra segurar
Se tiver me escutando por favor
Arruma um jeitinho e vem me ver
Eu estou aqui desesperada
Minha vida já não é nada sem você

E agora? e agora?
O que vou fazer sem teu amor?"
Meu Sorvete,"Você é meu sorvete cremoso e gostosinho
Deixa eu te beber de canudinho
Você é meu sorvete, é minha tentação
Morzinho já é seu meu coração

Adoro ficar coladinho em você
Só imaginando o que eu posso fazer depois
Nós dois se amando ao luar
Faz tempo que sinto essa vontade louca
Eu beijo seu rosto querendo na boca ah ra ah ra ah ra
Quem dera eu te pegar

Não posso imaginar você longe de mim
Por isso vou me declarar mesmo que seja o fim
Da nossa amizade que se transformou
Inesperadamente em amor ôô

Você é meu sorvete cremoso e gostosinho
Deixa eu te beber de canudinho
Você é meu sorvete, é minha tentação
Morzinho já é seu meu coração
Eu quero ver você se derretendo em minhas mãos"
Minha Favorita,"É só te ver que eu fico assim
Fico logo atrapalhado e fora de min
Quando toca me derreto me beija eu viajo
Assim é um homem apaixonado
É só te ver que eu fico assim
Fico logo atrapalhado e fora de min
Eu sei que isso é amor
Não tem explicação
Você dispara o meu coração

Fico o tempo todo sorrindo
Quando agente ama é tão lindo
Os olhos não conseguem disfarçar que eu...
Fico o tempo todo sorrindo
Quando agente ama é tão lindo
Você me fala que eu sou sua e você é meu
Você é mais de 100% é presente de Deus

Você é meu amor você é minha vida
Você é a melhor é minha favorita
Você é meu amor é minha paixão
Você dispara o meu coração."
Minha Namorada,"Se você quer ser minha namorada
Minha linda namorada
Você poderia ser
Mas você

Tem que fazer um juramento
Ser só minha nesse momento
Ser só minha até morrer

Saiba que eu te amo
E te adoro
E por você
Até choro
Se você não me quiser

Se você quer ser minha namorada
Minha linda namorada
Você poderia ser
Mas você

Tem que fazer um juramento
Ser só minha nesse momento
Ser só minha até morrer"
Modo Avião,"Você bem sabe que tudo é encanto
Que o amor que a gente faz é bem gostoso
E não me leva pra jantar já não entendo mais nada

Você só liga quando é madrugada
E eu cansada esperando em casa
Fingindo que não me traiu
Que conversa fiada

Acabou!
Já foi o tempo que meu coração era só seu
Não cuidou!
Estou no modo avião!

""O telefone móvel encontra-se desligado ou fora da área de cobertura! ""

Eu procurei ser fiel
Seu coração vagabundo
Tá me ligando, sextou!
Eu tô solteira no mundo
Eu procurei ser fiel
Seu coração vagabundo
Tá me ligando, sextou!
Eu to solteira no mundo



|
|
|"
"Money, Money, Money","Não pagou nada, money, money, money
Não cobrei nada, money, money, money
Eu fiz tudo por amoor,
Aqui se faz, aqui se paga

Se você não me procura mais,
Eu te digo, pra mim tanto faz
Eu conheço o seu jogo,
Vou jogar e dar o troco,
Só poque fico comigo, você, tchau!

Sô uma menina séria
Você brincou com coisa séria
Então não me procure mais,
Por favor me esqueça, vai,
Eu não quero ser mais sua, dá um tempo, sai

Eu que já fui louca por você,
Eu que já fiz tudo por você,
Eu não quero seu dinheiro,
Você eu não pago nada,
Não pago nada money, money, money
Não cobrei nada money, money, money,
Eu fiz tudo por amoor,
Aqui se faz, aqui se paaga
Aqui se paga, te amei, te amei,
Aqui se paga, te amei, te amei,
Eu fiz tudo por amoor,
Aqui se faz, aqui se paagaa

Se você não me procura mais,
Eu te digo pra mim tanto faz,
Eu conheço o seu jogo,
Vou jogar e dar o troco,
Só poque fico comigo, você, tchau!

Sô uma menina séria
Você brincou com coisa séria
Então não me procure mais,
Por favor me esqueça, vai,
Eu não quero ser mais sua, dá um tempo, sai!,

Eu que já fui louca por você,
Eu que já fiz tudo por você,
Eu não quero seu dinheiro,
Você eu não pago nada,
Não pago nada money, money, money
Não cobrei nada money, money, money

Eu fiz tudo por amoor,
Aqui se faz, aqui se paga
Aqui se paga, te amei, te amei,
Aqui se paga, te amei, te amei,
Eu fiz tudo por amoor,
Aqui se faz, aqui se paga

Quem sabe o quê quer ?
Capricho de mulher,
Se te conheço bem,
Vô te dizer qual é,

Você quer me amar,
Não para de pensar,
Esquece esse teu preço,
Que eu faço e aconteço,
Eu te levo pra cama,
Eu sou quem você ama!

Não pago nada money, money, money,
Não cobrei nada money, money, money
Eu fiz tudo por amoor,
Aqui se faz, aqui se paaga,
Aqui se paga, te amei, te amei,
Aqui se paga, te amei, te amei,
Eu fiz tudo por amoor,
Aqui se faz, aqui se paga.



Créditos : henderson. ;~d"
Morrendo de Desejo,"O que fazer para aceitar que acabou
Que não dá mais
É sempre assim quando um não deixa
O outro não faz
Quando já não tem
Tanta verdade num olhar
Quando já não tem
O jeito simples de beijar

Nada tem valor
Nem mais motivos pra ficar
Quando já não tem
Mais hora certa de chegar
Você quer voltar não tem ninguem pra lhe esperar
Você fica só e a solidão quer te matar

Amor Carente, amor ferido
Vai morrer de solidão
Que sofrimento que castigo quando o outro diz que não
Fica morrendo de desejo e não vê a solução

O que fazer para aceitar que acabou
Que não dá mais
É sempre assim quando um não deixa
O outro não faz (repete 2x)

Amor Carente, amor ferido
Vai morrer de solidão
Que sofrimento que castigo quando o outro diz que não
Fica morrendo de desejo e não vê a solução

O que fazer para aceitar que acabou
Que não dá mais
É sempre assim quando um não deixa
O outro não faz..."
Mulher Tarada,"Só gosto de mulher quente
de preferencia safada que usa
calcinha preta na bunda toda enfiada
(bis mais 1 vez)

Sou a mulher,a que você procurava
eu gosto de dar carinho,gosto de ser conquistada,
gosto de beijar na boca,gosto de ser paquerada
vou tirar minha calcinha porque hoje estou tarada!


"
Mulheres Perdidas,"Intro: C G D G7 D7
Solo
C G D G G7
e----12--------------12------------------------------------------------------------------------------I
B------13----------13---13-15-12---------12-15-12-13-------------10-13-10-12---10-12-13-12-10--------I
G---------12-10-9----------------12-9-7---------------14-11-9-7------------------------------12-10---I
D----------------------------------------------------------------------------------------------------I
A----------------------------------------------------------------------------------------------------I
E----------------------------------------------------------------------------------------------------I

D G D
As mulheres perdidas são as mais procuradas
Am D G
Eu vou procurar e vou encontrar
G7 C Repete 2 x
Se tem tantas mulheres perdidas assim
Am D G
Na calcinha preta tem uma pra mim

D G
Dá uma gemidinha... Ai!. Eu sou safadinha
C D G 2 x
Se você quiser eu tiro a calcinha

C G
Ai, Ai, Ai, Ai, eu vou te dar
D G 2 X
Uma calcinha preta pra você me amar

"
Nada A Mais,"Eu preciso te abraçar
eu te amo demais
meu corpo que sentir
teu calor

quando o amor em mim nasceu
que vontade de te amar
so queria ter você
e nada mais

eu ja fiz de tudo
por essa paixão
entreguei meu coração
não sei mais
o que vou fazer

coloquei seu nome no azul do ceu
mergulhei no teu olhar
fiz loucuras por
te amar

quero um tempo
pra pensar
posso áte
me entregar
quero ter você pra mim
pode esperar que eu vou

Eu preciso te abraçar
eu te amo demais
meu corpo que sentir
teu calor

quando o amor em mim nasceu
que vontade de te amar
so queria ter você
apagar essa dor
voltar a sorrir
nada mais!"
Não Chore Não,"Não Chore Não – Calcinha Preta

Não chore não, não chore não
Porque eu não quero mais
Estou pensando um jeito de poder te ver
Antes que o mundo acabe, que eu vá morrer
Sem solução, perdi você
E de novo é tarde, pra pedir perdão
Sei que é bem difícil, estou na contra mão
Sem solução, perdi você

Eu te falei, vai ficar só e eu não vou voltar
Não chore não, não chore não
Porque eu não quero mais
Não chore não, não chore não
Porque eu não quero mais

E de novo é tarde, pra pedir perdão
Sei que é bem difícil, estou na contra mão
Sem solução, perdi você

Eu te falei, vai ficar só e eu não vou voltar
Não chore não, não chore não
Porque eu não quero mais
Não chore não, não chore não
Porque eu não quero mais

Não tem como, não da mais
Não é assim, não quero mais

Não chore não, não chore não
Porque sou livre agora
Sou livre agora Vai
Tudo vai dar certo

Sou livre agora, Sou livre agora Vai
Tudo vai dar certo
Sou livre agora, Sou livre agora Vai
Tudo vai dar certo

Não chore não, não chore não
Porque não quero mais você"
"Não Desligue, Amor","Estou sentada aqui no bar
No mesmo lugar
Que a gente se encontrava
Pra tomar umas
E conversar
Pensando em você
E o que vou fazer
Pra não te perder

Amor
Não aguento mais
Sofro demais
Longe dos teus braços
Longe dos teus beijos
Tudo me faz pensar em você
E o que vou fazer
Pra não te perder
(vou desligar não quero saber)

Calma
Não desligue agora
Só mais um minuto
Deixe pelo menos
Ouvir tua voz

Diz que me ama
Não fique assim tão quieto
Estou sofrendo
Porque entre um copo e outro eu vou morrendo
E a saudade já não dá pra disfarçar

Diz que me ama
Não fique assim tão quieto
Estou sofrendo
Porque entre um copo e outro eu vou morrendo
E na solidão
Só penso em você

Eu faço tudo por você
Ponho anúncio na tv

Amor
Não agüento mais
Sofro demais
Longe dos teus braços
Longe dos teus beijos
Tudo me faz pensar em você
E o que vou fazer
Pra não te perder
(vou desligar não quero saber)

Calma
Não desligue agora
Só mais um minuto
Deixe pelo menos
Ouvir tua voz

Diz que me ama
Não fique assim tão quieto
Estou sofrendo
Porque entre um copo e outro eu vou morrendo
E a saudade já não dá pra disfarçar

Diz que me ama
Não fique assim tão quieto
Estou sofrendo
Porque entre um copo e outro eu vou morrendo
E na solidão
Só penso em você

Não desligue amor
Não me deixe aqui
Estou chegando aí no bar"
Não Diga Não,"Não diga não
Que não ama mais meu pobre coração
Que um dia foi sua fonte inspiração
Ai meu deus não vou ficar sem esse amor

Não diga não
Que já tem lá dentro do seu coração
Outro amor soprando feito um furacão
Te levando bem pra longe amor de mim

Te amo tanto pra viver
Assim tão longe de você amor
Vou embora pra não ver
Outro alguém que não sou eu
Ocupando meu lugar

Não dá pra negar que sou louco por você
Não dá não dá
Não dá pra negar minha vida é te querer
Não dá não dá
meu grande amor"
Não Disfarce,"Tá doendo em mim demais
Ver que você foi capaz
De fazer isso comigo

Tinha outro jeito
De se separar saindo numa boa
Já que não queria mais
Cada um seguia em paz

Mas você me fez de ex
Só brigamos uma vez
E eu fiquei no prejuízo

Nem terminou direito
E foi logo se envolver
Com outra pessoa
Numa troca tão voraz
Desse jeito não se faz

Você devia ser sincero
E confessar que me enganou
Do que deixar eu descobri
Que de repente me trocou

Não disfarce meu amor
Não precisava usar de nada disso

Não disfarce meu amor
Era mais fácil me dizer que acabou"
Não É Chuva de Verão,"Outra noite eu amanheço
Do meu lado o travesseiro
E você não está

A paixão bate no peito
Aumentando o meu desejo
De te encontrar

Cada lance cada cena
Que eu tenho nos meus sonhos
Você sempre está

Eu quero viver contigo
Ser bem mais que uma amiga
Te acolher quando precisar

Eu quero estar
Por toda vida
Guardado no seu coração

E te provar
Que nosso amor
Não é chuva de verão

Eu quero estar
Por toda vida
Guardado no seu coração

E te provar
Que nosso amor
Não é chuva de verão

Outra noite eu amanheço
Do meu lado o travesseiro
E você não está

A paixão bate no peito
Aumentando o meu desejo
De te encontrar

Cada lance cada cena
Que eu tenho nos meus sonhos
Você sempre está

Eu quero viver contigo
Ser bem mais que uma amiga
Te acolher quando precisar

Eu quero estar
Por toda vida
Guardado no seu coração

E te provar
Que nosso amor
Não é chuva de verão

Eu quero estar
Por toda vida
Guardado no seu coração

E te provar
Que nosso amor
Não é chuva de verão

Eu quero estar
Por toda vida
Guardado no seu coração

E te provar
Que nosso amor
Não é chuva de verão

Eu quero estar
Por toda vida
Guardado no seu coração

E te provar
Que nosso amor
Não é chuva de verão
Não é chuva de verão
Não é chuva de verão"
Não Faz Sentido,"Não, não vá embora
Tô precisando de você agora
Não, não faz sentido
O nosso amor está correndo risco
Não quero te perder
Pra que sofrer, deixa disso e vem para mim
Me diz o que eu vou fazer
Pra te esquecer por favor não faz assim
Nâo, não, não, não diz besteira
Eu sei que tudo é brincadeira
Você é meu bem querer
E por favor não faz assim
Me diz que eu sou teu amor
E por favor não me deixe assim tão só
E por favor não me deixa assim tão só."
Não Fique Longe de Mim,"Não Fique Longe de Mim
Não fique longe assim de mim
não vê que estou aqui
estou morrendo de amor

O meu coração se apaixonou
o meu corpo dominou
estou morrendo de amor
sei que não é fácil
entender como eu estou
vem ficar comigo vem
te amo meu amor

(refrão)
Você é o meu amor
já não aguento mais
suportar tanta dor
a dor de não poder voltar
e ter vc aqui...
Não fique mais longe de mim!

sei que não é fácil
entender como eu estou
vem ficar comigo vem
te amo meu amor

(refrão)
Você é o meu amor
já não aguento mais
suportar tanta dor
a dor de não poder voltar
e ter vc aqui...
Não fique mais longe de mim!"
"Não Gruda, Não Cola","Não gruda não cola, não quero mais você, sai sai sai
sai
Pisou na bola pode me esquecer bye bye bye bye bye
bye
Não gruda não cola, não quero mais você, sai sai sai
sai
Pisou na bola pode me esquecer bye bye bye bye bye bye


Eu era toda sua quando a gente se encontrava, eu
passava a noite te fazendo mil loucuras.
Nunca falei que ia te dar o meu amor, não tenho culpa
se você se apaixonou.
Quem mandou abrir seu coração? Comigo não!
Quer levar a sério essa paixão!

Não! não! Não quero acreditar! Você era pegador e
agora quer casar!
Não! não! Eu só quero ficar! Eu brinquei com você e
não quero me amarrar!
Não! não! Não quero acreditar! Você era pegador e
agora quer casar!
Não! não! Eu só quero ficar! Eu brinquei com você e
não quero me amarrar!

Não gruda não cola, não quero mais você, sai sai sai
sai
Pisou na bola pode me esquecer bye bye bye bye bye
bye

Eu era toda sua quando a gente se encontrava, eu
passava a noite te fazendo mil loucuras.
Nunca falei que ia te dar o meu amor, não tenho culpa
se você se apaixonou.
Quem mandou abrir seu coração? Comigo não!
Quer levar a sério essa paixão!

Não! não! Não quero acreditar! Você era pegador e
agora quer casar!
Não! não! Eu só quero ficar! Eu brinquei com você e
não quero me amarrar!
Não! não! Não quero acreditar! Você era pegador e
agora quer casar!
Não! não! Eu só quero ficar! Eu brinquei com você e
não quero me amarrar!"
Não Me Deixe Agora,"Te peço aflito
Que não quero um dia te perder
Eu sei tô sofrendo
Também sei que niguem vai resolver
Algumas vezes penso e tento te esquecer
Mas eu te quero, porque amo você

São tantas histórias
Que o povo fala pra mim
Que a noite lá fora
Encontram você por ai
Algumas vezes penso e tento te esquecer
Mas eu te quero, porque amo você

(Refrão)
Não, não me deixe agora, porque existe amor
Não agora, amor, meu amor
Se está longe, longe eu vou te buscar
Te buscar..."
