SName,Lyric
Paulinha,"Não há quem te ame tanto
Envolvido em seus encantos
Não há jeito de não ter o seu amor
Agora soube que você já se casou
Por que casou?

Se te vejo, rezo, choro
E ao segurança imploro
É linda e é mais linda lá no show
Agora soube que você já se casou
Por que casou?

Paulinha, me diz o que é que eu faço?
Paulinha, te amo, amor
Paulinha, me diz o que é que eu faço?
Paulinha, por que se casou?"
Liga Pra Mim,"Liga pra mim
Eu tenho tantas coisas pra te falar
Liga pra mim
Vai ser tão bom, nós Precisamos conversar

Todos sabem que eu te amo
Só você e mais ninguém
Eu te vejo em qualquer lugar que eu vá
E sei também, você anda louco pra voltar

Não faz assim
Eu me deprimo todo sem você aqui
Não faz assim
Sem este amor meu Deus o que vai ser de mim?


Todos sabem que eu te amo
Só você e mais ninguém
Eu te vejo em qualquer lugar que eu vá
E sei também, você anda louco pra voltar

Vem depressa por favor
Dê uma chance ao nosso amor
Oh vem! Oh vem!
Vem depressa por favor
Dê uma chance ao nosso amor

By Edwilson Sousa"
Ainda Te Amo,"Já faz tempo
Que esse meu coração
Tá batendo sem jeito,sem graça
E até meu violão
Não mais toca a canção
Aquela que a gente gostava

Esqueceram de nós
Não me perguntam mais como vai você
E das marcas, o que mais faz doer
É saber que eu tenho que te esquecer

É que eu ainda te amo
Te quero demais
Não posso te ver longe assim
Fugindo de mim
Há coisas que não dá pra apagar

Ainda te amo
Como antigamente
E sei que em seu coração
Nosso amor não acabou completamente"
Agora Estou Sofrendo,"Não há amor para mim, não
Você estava mentindo
Diga logo que não me amou

Que não gostou de mim
Não sente amor por mim

Quais as armas que encontra
Pra fazer seus encantos
Derramar seu amor em mim

Mas não gostou de mim
Não sente amor

Me fere, me risca de amor
E foge, não me alimenta
Não sabe que já me conquistou
Agora estou sofrendo"
Declaração de Amor,"Hoje me deu uma vontade louca alucinada
De me declarar pra você
Te amar é bom demais

E só você me faz voar no céu azul, mergulhar no oceano
sem medo nenhum
Quero te prometer o que você quiser
Todo o meu amor
Estrela guia me carregue para onde for
Te amo, te amo

Eu sei que um dia a gente pode se perder
Mas não vai ser assim se depender de mim
Porque eu vou lutar pra nunca acabar
Haja o que houver venha o que vier
Inverno ou verão
Em qualquer estação

Só vou gritar amor, amor, amor
Menino eu te amo
tá difícil de viver a vida sem você
Menino eu te quero vou virar o mundo
Mas amor vou ter você"
Louca Por Ti,"Amor demais,
Lembro dos momentos que te amei demais.
Foi assim,
Só Nós dois na Praia
E eu me perdi.
Louca Por Ti,
Foi Amor de mais,
Louca por Ti.

Amor demais,
Lembro dos momentos que te amei demais.
Foi assim0,
Só Nós dois na Praia
E eu me perdi.
Louca Por Ti,
Foi Amor de mais,
Louca por Ti, i, i, i, i
Uuu....

Amor demais,
Lembro dos momentos que te amei demais.
Foi assim0,
Só Nós dois na Praia
E eu me perdi.
Louca Por Ti,
Foi Amor de mais,
Louca por Ti, i, i, i
Uuu...

//
Te amo tanto pra viver,
Assim tão longe de você amor.
Vou embora pra não ver,
Outro alguém que não sou;
O|cupando meu lugar.

Não dá pra negar que sou louco por você,
Não dá, não dá
Não dá pra negar minha vida é te querer.
Não dá, Não dá
Meu grande Amor...

Não diga não...
Que já tem lá dentro do seu coração...

Não diga não,
Não....

Não diga não, não, não..."
Hoje À Noite,"A noite passa devagar, estou aqui deitado só
no tic-tac do relogio, me aqueço com o seu lençol

Gostaria de saber onde você está
Hoje à noite você nao vai acabar..... sozinha

Amor, eu sempre estive sozinha
Eu nunca me importei, até lhe conhecer
E agora você me escolhe
Como deixá-lo sozinho(2x)

Você não sabe o quanto eu quis
te abraçar, tocar seus lábios, beijar, amar você
Não sabe quanto eu esperei dormir com você hoje a noite
Mas o segredo ainda esta comigo
O Meu amor por você é demais"
Sonho Lindo,"Como foi tão bom a gente se encontrar
Eu tava precisando de alguem assim
Num canto reservado pra gente se amar
Que esse amor resista até o fim

Tocar o seu corpo é viajar pro céu
Beijar sua boca tem sabor de mel
Você é o sonho lindo que eu sonhei pra mim

Vem me amar
Vem pra mim
Vem me amar
Diz que sim
que esse amor não vai ter fim
você é um sonho lindo que sonhei pra mim
Você é o sonho lindo que eu sonhei pra mim!"
Manchete dos Jornais,"Eu faço tudo por você.
Ponho um anúncio na tv.
Mostro meu
Coração pra todo mundo ver,
Por que eu amo você.

Pare de dizer que não me ama
Que não vai voltar
Que eu não sou e nem serei mais
Dono do seu coração
Que não tá nem ai pra mim
Com quem eu saio,
O que faço,
Com quem fico
Que eu posso até me matar
Não venha agora me dizer
Que tanto amor e as flores
Que regamos juntos
Já morreram no nosso jardim
Pois eu te digo não desisto
Você sabe muito bem que sou capaz de até parar...
O mundo de girar pra te reconquistar
Dar uma de super-heróI
Amor vou te mostrar pago que preço for
Pra resgatar o seu amor...

(refrão)
Eu faço tudo por você (2*)
Ponho um anúncio na tv
Mostro meu coração pra todo mundo ver
Eu não desistirei jamais viro manchete dos jornais
Eu vou fazer de tudo pra não te perder
Porque amo você."
O Navio E O Mar,"Foi você quem me escolheu
Quando entrou no meu mar
Navegou, não quis saber
Atracou no meu cais
E agora quer me deixar
Não, não posso aceitar
Quem jamais vai separar
O navio e o mar

Sem ninguém
Por favor, compreenda
Sem ninguém, sem ninguém
Numa ilha só
Foi você quem me escolheu
Quando entrou no meu mar
Navegou, não quiz saber
Atracou no meu cais

Sem ninguém
Por favor, compreenda
Sem ninguém, sem ninguém
Numa ilha só

Foi você quem me escolheu
Quando entrou no meu mar
Navegou, não quiz saber
Atracou no meu cais
E agora quer me deixar
Não, não posso aceitar
Quem jamais vai separar
O navio e o mar.

Sem ninguém
Por favor, compreenda
Sem ninguém, sem ninguém
Numa ilha só"
Baby Doll,"Só você sabe me fazer mulher
Só você faz tudo o que eu quiser
Só você entende o meu coração
Enche meu corpo de tesão
Vem amor pra mim
Que eu estou aqui
A te esperar

Ontem sonhei com você
Estava no quarto tão só
Estava tão linda vestida
Naquele baby doll

Melei minha boca de mel
Pensando só em você
Amor, eu te quero,
Preciso desse teu prazer

[refrão]
E quando você toca em mim
Ah, ah, ah!
Eu fico toda molhada
Te juro fico logo a fim
Ah, ah, ah!
Eu fico arrepiada
(2x)

Ontem sonhei com você
Estava no quarto tão só
Estava tão linda vestida
Naquele baby doll

Melei minha boca de mel
Pensando só em você
Amor, eu te quero,
Preciso desse teu prazer

[refrão]
E quando você toca em mim
Ah, ah, ah!
Eu fico toda molhada
Te juro fico logo a fim
Ah, ah, ah!
Eu fico arrepiada
(2x)

Ah!"
Mágica,"Certos dias o vento traz o teu cheiro e eu me levanto da cama assustada lá pelas tantas da madrugada
Com um gosto amargo na boca
É...aquele amargo da saudade que perturba, tira o sono e não passa, não passa.

Para, Eu não vou suportar toda essa barra.
Meu coração um dia desses para!
Preciso te ter essa noite não importa a hora
Pra não enlouquecer....

Marca, aonde vou te ver
Quem sabe no mesmo lugar
Aonde a gente ia sempre se amar
Repartindo o mesmo lençol
Sentindo a luz do sol tocando a alma
Será que é difícil entender

Parece mágica
Essa paixão me aquece em todas estações
Não sei o que fazer
Parece mágica
Nascemos um pro outro a lua e o mar
O sol e o amanhecer
Nada conseguirá mudar
As nossas vidas já foram traçadas
Pra sempre eu serei a sua amada"
Por Que Tocou Meu Coração?,"Por que tocou meu coracão me deixar em suas mãos me
diz
pra onde foi que eu não sei o que fazer.
Você chegou e me ganhou nunca fui de ninguém assim
me diz pra onde foi que te quero outra vez.
Eu preciso te encontrar com você quero ficar eu não
vejo a hora de poder te abraçar.x2
Por que tocou o meu coração me deixar em suas mãos me
diz pra onde foi que eu não sei o que fazer
você chegou e me ganhou nunca fui de ninguém assim
me diz pra onde foi que te quero outra vez.
Eu preciso te encontrar com você quero ficar eu não
vejo a hora de poder te abraçar.x2
REFRÃO
Saiba que sou seu amor e não quero te perder não há
amor
no mundo não há amor maior.
Eu preciso te encontrar com você quero ficar eu não
vejo a hora de poder te abraçar.
Eu preciso te encontrar com você quero ficar eu não
vejo a hora de poder te abraçar.
Saiba que sou seu amor e não quero te perder que não
há
amor no mundo que não há amor maior.
Eu preciso te encontrar com você quero ficar eu não
vejo a hora de poder te abraçar.
Eu preciso te encontrar com você quero ficar eu não
vejo a hora de poder te abraçar. x2

A dor não é suficiente pra dizer como me sinto nós
fomos
tão felizes juntos, mas agora eu sei que você se foi,
você disse que jamais iria me abandonar.
Sempre que eu precisasse você estaria aqui, eu posso
te perdoar, mas não posso te esquecer, e mesmo que você
tenha me deixado...
Ainda te amo!
Ainda te amo!"
Como Fui Me Apaixonar (halo),"Como fui me apaixonar
Mesmo sem te conhecer
Baby eu estou sofrendo
Baby onde está você?

Comigo aconteceu assim
Foi quando eu te vi passar
E sem nenhuma explicação
Meu coração mandou parar

Fiquei te admirando alí
Te olhando sem me desviar
De repente então você sumiu
E não pude mais te encontrar

Eu não sei o que aconteceu
Não tem resposta para o que aconteceu
Passei a gostar de você
Não pergunte, não sei explicar

Refrão:
Como fui me apaixonar
Mesmo sem te conhecer
Baby eu estou sofrendo
Baby onde está você?

Como fui me apaixonar
Mesmo sem te conhecer
Baby estou te querendo
Baby onde está você?

(can see your halo, halo, halo)

Não vou mudar meu coração
Preciso me acostumar
Se o que ele sente é bom
É o amor que está no ar

Não há nada a fazer
É um sentimento raro
É só deixar acontecer
Pra mim tá tudo muito claro

Eu não sei o que aconteceu
Não tem resposta para o que aconteceu
Passei a gostar de você
Não pergunte, não sei explicar

(refrão)

Can see your halo, halo, halo...
Halo, halo, halo...
Halo, halo, halo..."
Como Vou Deixar Você?,"Eu briguei
Estava fora de mim
Tanto que te expulsei
Mais como vou deixar você?
Se eu te amo
Amo,amo,amo...

Por onde você anda nessa hora
Eu juro que pago pra saber
Meu Deus eu mandei o meu amor embora

Amor,amor...
Amor,amor...
Meu amor eu amo você"
Você Não Vale Nada,"Você não vale nada,
Mas eu gosto de você!
Você não vale nada,
Mas eu gosto de você!
Tudo que eu queria
Era saber porquê?!?
Tudo que eu queria
Era saber porquê?!? (2x)

Você brincou comigo,
Bagunçou a minha vida.
E esse sofrimento
Não tem explicação.
Já fiz de quase tudo tentando te esquecer.
Vendo a hora morrer
Não posso me acabar na mão.
Seu sangue é de barata,
A boca é de vampiro.
Um dia eu lhe tiro
De vez o meu coração.
Aí já não lhe quero
Amor me dê ouvidos
Por favor me perdoa
Tô morrendo

Eu quero ver você sofrer
Só pra deixar de ser ruim
Eu vou fazer você chorar, se humilhar
Ficar correndo atrás de mim.(2x)

Você não vale nada,
Mas eu gosto de você!
Você não vale nada,
Mas eu gosto de você!
Tudo que eu queria
Era saber porquê?!?
Tudo que eu queria
Era saber porquê?!? (2x)"
"Dois Amores, Duas Paixões","Oi, tudo bem?
Como é que eu posso
Estar bem,
Se você não se decide?
Eu preciso de uma
Resposta agora!
Ou ela ou eu?

Não, não posso
Tomar essa decisão.
E acabar com
O meu coração
Que já se acostumou
Não, eu tenho
Tanto medo de perder
Escolher uma e
Me arrepender
Eu tenho medo

Não vou me acostumar
Você vai ter que escolher
Pois do jeito que está
Baby, você pode acabar sozinho
Mas se quiser me amar
Não te divido com ninguém
Nessa historia de harém
Amor, não dá, não dá.

(refrão)
Duas paixões, dois amores.
É loucura que somente
O coração pode explicar
Me perdoe
É que sem ela eu não vivo
E sem você não sei ficar
Tem jeito não
Eu te amo mas a três
Não rola não."
E O Vento Levou,"Desde o dia em que você se foi
Eu não consigo mais dormir
Eu não consigo te esquecer

Tá faltando alguma coisa em mim
Porque uma parte está aqui
A outra ficou com você

Um pedaço do meu coração
Na estrada ficou e o vento levou
Não me deixe nessa solidão
Você não sabe o que você
É para mim

Volta, estou tão sozinha
Se for preciso eu largo tudo
E vou te amar

Chega de rolar na cama
Não quero mais o travesseiro
Em seu lugar"
Novo Amor,"se quiser partir eu não vou deixar,
eu não vou me acostumar
com um novo amor pensando em ti...
e se me disser que não me quer mais
que está amando outro rapaz,
pelo amor de deus não quero ouvir
eu vou me matar,me jogar ao mar...
preciso saber que foi que eu fiz,amor..
foi você quem quis assim,
não quis cuidar de mim me teve
mas não soube dar valor.
hoje eu quero um outro alguém que me ame também
que me dê carinho e me dê amor...
se quiser partir eu não vou deixar,
eu não vou me acostumar
com um novo amor,eu vou me matar,me jogar ao mar...
preciso saber que foi que eu fiz,amor..
foi você quem quis assim,
não quis cuidar de mim me teve
mas não soube dar valor.
hoje eu quero um outro alguém que me ame também
que me dê carinho e me dê amor...muito amor...."
Já me Acostumei,"Te falo a última vez
Não sei se vou me arrepender
Eu sei que é bem melhor assim
A nossa história chega ao fim
Não lembro mais se era bom
Eu só sinto a dor

O que me fez e o que falou
Como fingiu me enganou
As dúvidas que provocou
Como mentiou falou de mim
A nossa história chega ao fim
Só ficou a dor


Au uuuu, au uuu, au uuu


Mas é passado, já ficou pra trás
Não quero mais ouvir sua voz
O seu sorriso, se desfez de nós
Já me acostumei pela última vez

Mas é passado, já ficou pra trás
Não quero mais ouvir sua voz
O seu sorriso, se desfez de nós
Já me acostumei pela última vez
Adeus!


Au uuuu, au uuu, au uuu


Passou a sensação, não sei
Ser enganado é tão ruim
Só sei que vai se arrepender
E vai querer voltar pra mim
Mas saiba que não sou mais seu
Te desejo a dor


Au uuuu, au uuu, au uuu


Mas é passado, já ficou pra trás
Não quero mais ouvir sua voz
O seu sorriso, se desfez de nós
Já me acostumei pela última vez

Mas é passado, já ficou pra trás
Não quero mais ouvir sua voz
O teu sorriso, se desfez de nós
Já me acostumei pela última vez
Adeus!

Adeus!"
O Que É Que Eu Vou Fazer?,"O que é que eu vou fazer?
Pra trazer de volta a felicidade
O que é que eu vou fazer?
Se longe de vc meu mundo é só saudade
O que é que eu vou fazer?
Sem o teu amor e sem o teu carinho

Não te prometi verão nem primavera
Nem o mundo todo lindo pra você
Você sabe que um dia a chuva cai
E o vento forte ás vezes faz cair
As folhas do quintal

Mas se você tem motivos pra sair
Me deixar aqui
Sem me dizer adeus
Eu não tenho culpa
Se eu podesse ter o mundo ao seus pés
Todo ouro que eu podesse lhe entregar
Eu juro te daria
E sem falar das cartas que escrevi
Das palavras doces que eu ja falei
Somente pra você
Não me diga não
não, não
Não me deixe aqui

O que é que eu vou fazer?
Pra trazer de volta a felicidade
O que é que eu vou fazer?
Se longe de você meu mundo é só saudade
O que é que eu vou fazer?
Sem o teu amor e sem o teu carinho"
Retrato,"É com você que eu vou viver essa paixão
Eu sou completamente louco por você
Eu não consigo nem pensar em solidão.
Eu só penso em você, iê iê.
Eu só sei amar você, iê, iê

Hoje eu chorei em meu quarto
Ao ver seu retrato lindo
Na parede, é tanta saudade
Que meu peito invade, amor
Grito o seu nome

Tento disfarçar
Mas não sei como fugir
Sem você não dá
Onde você se esconde?
Chego do trabalho
Tomo banho e saio à noite,
Novamente

A te procurar
Prometo te dar amor
Eternamente
Quero te falar
Que eu já me decidi
Com você vou ser feliz

É com você que eu vou viver essa paixão
Eu sou completamente louco por você
Eu não consigo nem pensar em solidão.
Eu só penso em você, iê iê.
Eu só sei amar você, iê, iê

Meu amor"
Todo Mundo Tem Um Sonho Pra Realizar,"Eu te amo uu todo mundo tem um sonho para realizar
Eu sei não devia nunca, nunca te abandonar
Por que minha vida só tem graça com você
Eu tenho tanta coisa linda pra te falar

Errar é humano e hoje eu vim te ver
Eu te amo uu todo mundo tem um sonho para realizar
Mas essa é a minha casa, me faz bem
Juro essa é a minha casa, e a sua também

Sei que errei, não vou mas errar me perdoei mais uma vez
Não meu deus não me deixe, eu sem você outra vez
Eu sei não devia nunca, nunca te abandonar
Por que minha vida só tem graça com você

Eu tenho tanta coisa linda pra te falar
Errar é humano e hoje eu vim te ver
Eu te amo uu todo mundo tem um sonho para realizar
Mas essa é a minha casa, me faz bem

Juro essa é a minha casa, e a sua também
Sei que errei, não vou mas errar me perdoei mais uma vez
Não meu deus não me deixe, eu sem você outra vez
Vou te amar mais uma vez pra sempre, vou te amar

Oh amor eu te quero tanto
Já falei que é você quem eu amo
Não vou brincar com seu amor
Eu te mando flores, são pra você meu bem

Quem não errou me fale, que não errou também
Sei que todos sabem que sou louco, louco, louco por você
Vim te pedir pra me perdoar e voltar pra mim
Vim te pedir pra me perdoar e voltar pra mim
Eu te amo


Video - http: ww. youtube. com watch? v wgziyog5rtg"
Se Tu Não Estás,"Quando o sol nascer será a hora
Triste mais eu tenho que partir
Levo o seu aplauso na memória
E todo calor que recebi

Quando estiver longe
Se perder o sono
Vou pensar que ouço
Uma voz me chamando gritando por mim

Já amanheceu e vou embora
Triste porque é hora de partir
Levo o seu sorriso na lembrança
Emoção maior que eu vivi

Quando estiver longe
Se perder o sono
Vou pensar que ouço
Uma voz me chamando gritando por mim

Meu coração a dizer
Que só você me faz feliz
Preciso agora levar a serio
O que ele diz

Meu coração a dizer
Que só você me faz feliz
Preciso agora esquecer tudo
E retornar

Quando estiver longe
Se perder o sono
Vou pensar que ouço
Uma voz me chamando gritando por mim

Meu coração a dizer
Que só você me faz feliz
Preciso agora levar a serio
O que ele diz

Meu coração a dizer
Que só você me faz feliz
Preciso agora esquecer tudo
E retornar"
A Calcinha Preta é Nossa,"Hu! Ha! Ha! A Calcinha é nossa!
É da Calcinha que eu gosto
Carrego no coração
Inverno ou verão
Estou esperando você
É da Calcinha que eu gosto
Carrego no coração
Inverno ou verão
O meu coração vai ferver
Qual é? Não fique em casa chorando
Porque a Calcinha Preta chegou pra você
É nossa, é nossa, é nossa!!!
Qual é? Não fique em casa chorando
Porque a Calcinha Preta chegou pra você
É nossa, e nossa, e nossa!!!
Onde tem Calcinha eu vou - 2×
Onde tem Calcinha Preta eu vou, eu vou, eu vou

Amanda Cerqueira"
12 de Junho,"Fez diferença eu ter aberto
O carro pra você entrar
Fez diferença você ter
Me chamado para gente jantar
Fez diferença um buquê, e eu te digo o porquê
Um homem nota uma mulher assim
Fez diferença você ligar para mim

Fez diferença
Perder a sexta-feira toda no salão
Fez diferença fazer o meu cabelo, pé e mão
Fez diferença eu te ver, eu te digo o porquê
Um homem nota uma mulher assim
Fez diferença o teu olhar para mim

Vou te surpreender
Foi 07 de junho que eu abri o carro
08 O restaurante que você marcou
09 Peguei as rosas na floricultura
10 Foi o salão que você se arrumou
Vou te surpreender
11 Eu ganhei o meu primeiro beijo
12 Fica em off o que aconteceu
Essa data fica entre você e eu

Sempre ao teu lado, você fique sabendo
Que nenhum segundo, que nenhum momento
Que nada despercebido passou
É diferente o nosso amor"
24 Horas de Amor,"14 horas de amor, com mais 3 de paixão
São 7 de prazer para o meu coração
24 horas de amor estou pensando em você
Esta parecendo que virou um vicio

Estou pegando fogo, vem molhar o meu corpo
Quero ver se vai resistir o que tenho aqui
Minha vida sem você sem aventura
Um cenário de paixão e de prazer
Fico louca quando toca o meu corpo
Conto as horas pra que a gente va se vê...

14 horas de amor, com mais 3 de paixão
São 7 de prazer para o meu coração
24 horas de amor estou pensando em você
Esta parecendo que virou um vicio (Bis)
Tatuagem que agarrou
Que virou juras de Amor

Fica comigo


Postado por Luiz Fernando Soares"
A Calcinha Preta É Nossa 2,"Se tem Calcinha eu vou lá
Seguindo a multidão
No meio dessa galera eu fico numa boa
Eu tô no mundo da lua
É pra se apaixonar
Chorar de tanta emoção
Eu nunca vi nada igual faça sol ou faça chuva
Eu tô no mundo da lua

Nesse pra lá e pra cá
Eu vou fazer zueira eu vou zuar
Deixo o som me levar
E atrás da Calcinha eu vou

Meu amor te encontrar, te encontrar
A Calcinha é Nossa
Meu amor hoje eu vou te encontrar
A Calcinha é Nossa

Se tem Calcinha eu vou lá
Seguindo a multidão
No meio dessa galera eu fico numa boa
Eu tô no mundo da lua
É pra se apaixonar
Chorar de tanta emoção
Eu nunca vi nada igual faça sol ou faça chuva
Eu tô no mundo da lua

Nesse pra lá e pra cá
Eu vou fazer zueira eu vou zuar
Deixo o som me levar
E atrás da Calcinha eu vou

Meu amor te encontrar, te encontrar
A Calcinha é Nossa
Meu amor hoje eu vou te encontrar
A Calcinha é Nossa

Meu amor te encontrar, te encontrar
A Calcinha é Nossa

A Calcinha é Nossa
A Calcinha é Nossa
A Calcinha é Nossa
A Calcinha é Nossa
A Calcinha é Nossa
A Calcinha é Nossa"
A Casa Caiu,"Eu descobri que tem um outro amor
Todo esse tempo só me enganou
Mas a verdade chega com o tempo
Revelando fingimentos
Você não presta

Agora eu saquei
Porque não larga o celular
Com medo que ele possa te ligar

E não adianta disfarçar
Hoje eu vou te desmascarar
Você não vale nada
Você não tem coração
Já descobri a sua armação

A casa caiu
A farsa acabou
Pra mim e pra ele
Jurou seu amor
A casa caiu
Perdeu seu harém
Queria as duas
Ficou sem ninguém

A casa caiu
A farsa acabou
Pra mim e pra ele
Jurou seu amor
A casa caiu
Perdeu seu harém
Queria as duas
Ficou sem ninguém"
A Coisa Mais Linda,"Chama a calcinha Daniel
Vem gostosa...

A coisa mais linda que eu vi na minha vida
Foi uma mulher deitada na cama
De calcinha Preta arregada na bunda
Ela me chamava e eu logo ía

(Dança Fortaleza)

A coisa mais linda que eu vi na minha vida
Foi uma mulher deitada na cama
De calcinha Preta arregada na bunda
Ela me chamava e eu logo ía

Eu dava carinhos e ela sorria]
Beijava seu corpo e ela gemia
Eu ia pra cima e ela gritava
E quando eu parava ela me dizia
Ai amor não para não

Eu continuava e ela gostava
Eu dava carinhos e ela sorria]
Beijava seu corpo e ela gemia
Eu ia pra cima e ela gritava
E quando eu parava ela me dizia
Ai amor não para não


No final de tudo ela me abraçava
Dizia que me amava e que não me largava
A sua calcinha calcinha ela me entregava
A calcinha preta eu carreguei pra casa

Ai, ai ,ai ,ai"
A Conquista,"O meu amor, virou brinquedo pra ti
Depois vem de mansinho
Querendo agradar
Falando palavras bonitas
Pra me conquistar
Só não aceito esse teu jeito
De querer me amar

Venha meu amor
Não me deixe assim
Preciso de você, aqui perto de mim

Tenha dó, venha por favor
Estou querendo alguem como você aqui
Pra me abraçar e me beijar
Me fazer feliz como eu sempre quiz

Você é minha paixão
É o meu dia ensolarado
Ficar com você é como sonhar acordado
Ver e não ter

Um dia que passa mais apaixonado estou
Oh lua que vem, traga ela por favor
É minha jóia rara
É o meu pedaço do céu
Ficar com você é como sonhar acordado
Ver e não ter

O meu amor, virou brinquedo pra ti
Põe na minha boca o mel
Logo em seguida o fel
Depois vem de mansinho
Querendo agradar
Falando palavras bonitas
Pra me conquistar
Só não aceito esse teu jeito
De querer me amar(2X)

Um dia que passa mais apaixonado estou
Oh lua que vem, traga ela por favor
É minha jóia rara
É o meu pedaço do céu
Ficar com você é como sonhar acordado
Ver e não ter

O meu amor, virou brinquedo pra ti
Põe na minha boca o mel
Logo em seguida o fel
Depois vem de mansinho
Querendo agradar
Falando palavras bonitas
Pra me conquistar
Só não aceito esse teu jeito
De querer me amar (2x)

Depois vem de mansinho
Querendo agradar
Falando palavras bonitas
Pra me conquistar
Só não aceito esse teu jeito
De querer me amar . ."
